ad_archive_id,claims_to_questions,stance_results,verdict,stance_counts
942824157566893,"{""Stev\u043e Pendarovski is our European president!"": {""Questions"": [{""question"": ""What is the current European president?"", ""search_results"": [""European Council President \u2013 Ant\u00f3nio Costa \u00b7 leads the European Council's work in setting the EU's general political direction and priorities \u2013 in cooperation\u00a0..."", ""President of the European Union \u00b7 the President of the European Council (since 1 December 2024, Ant\u00f3nio Costa) \u00b7 the President of the European Commission (since 1\u00a0..."", ""Ursula von der Leyen was the first woman to become President of the European Commission in 2019. She was elected for a second mandate by the European\u00a0...""], ""stance"": ""Partially Supports""}, {""question"": ""Who are the candidates running for the President of North Macedonia?"", ""search_results"": [""The two faced off in the second round run-off on 8 May, which was held alongside parliamentary elections. ... In the second round, Siljanovska defeated the\u00a0..."", ""Apr 25, 2024 ... North Macedonia's right-wing candidate Gordana Siljanovska-Davkova claimed a comprehensive victory in the first round of presidential elections on Wednesday."", ""Apr 15, 2024 ... On Wednesday, April 24, North Macedonia will hold presidential elections. Elections take place among political tensions within the country,\u00a0...""], ""stance"": ""Refute""}, {""question"": ""Is Stev\u043e Pendarovski indeed the European president?"", ""search_results"": [""Apr 19, 2023 ... ... European Union accession. Throughout this period the largest ... President Stev\u043e Pendarovski also expressed his opposition: \u201cThe\u00a0...""], ""stance"": ""Completely Supports""}]}, ""Let's support him with our presence at the big civil march on Monday, April 8th, at 20:00 in the park near the monument to Jane Sandanski."": {""Questions"": [{""question"": ""Is the location specified for the civil march (park near the monument to Jane Sandanski) accurate?"", ""search_results"": [""In World War II, the city was again captured by Bulgaria and in 1945 became the capital of SR Macedonia, a federated state within Yugoslavia. The city developed\u00a0..."", ""Feb 26, 1997 ... The current nomination proposes extension of the Pirin National park as a World Heritage. Property, designated in 1983, by means of inclusion of\u00a0..."", ""Until a solution was found, the provisional reference \""the former Yugoslav Republic of Macedonia\"" (FYROM) was used by multiple international organisations and\u00a0...""], ""stance"": ""Irrelevant""}, {""question"": ""What is the exact date of the presidential election in North Macedonia?"", ""search_results"": [""Apr 15, 2024 ... The president serves a five-year term and is elected by an absolute majority vote through a two-round system (see \u201cWhen is Election Day?\u201d). In a\u00a0..."", ""May 9, 2024 ... North Macedonia's presidential run-off and parliamentary elections were competitive and an extensive and pluralistic campaign helped voters to make an informed\u00a0..."", ""The ODIHR EOM and the OSCE Mission to Skopje operate separately under their specific mandates. More info... Presidential Election, 21 April and 5 May 2019.""], ""stance"": ""Irrelevant""}, {""question"": ""Do the presidential candidates mentioned (Biljana Vankovsk\u00ebn, Maksim Dimitrievski, and Stef\u00e7e Jakimovski) have concrete proposals for their platforms?"", ""search_results"": [], ""stance"": ""No Evidence""}]}, ""On April 24th let's vote for number 1."": {""Questions"": [{""question"": ""What is the date mentioned in the text as the day to vote?"", ""search_results"": [""... elections office no later than 7 days after Election Day. If you are not sure ... ballot by specified dates as determined by the county elections official."", ""What is the postmark rule / Can I mail my ballot on Election Day? ... \u200b\u200b\u200b\u200b\u200b\u200b\u200b\u200bYou can track your ballot's progress on our website by entering your name and date\u00a0..."", ""... elections or the State Board of Elections. You can also register to vote during early voting or on election day. Go to an early voting center in the county\u00a0...""], ""stance"": ""Partially Supports""}, {""question"": ""What are some promises and slogans that presidential candidates have started offering, according to the text?"", ""search_results"": [""Jan 11, 1989 ... It's been the honor of my life to be your President. So many of you have written the past few weeks to say thanks, but I could say as much to\u00a0..."", ""Sep 10, 2024 ... In Virginia, nevertheless, if I have not been misinformed, elections ... Were the pictures which have been drawn by the political jealousy of some\u00a0..."", ""Jun 7, 2013 ... ... promises that \u201call men are created equal\u201d and have \u201ccertain unalienable rights.\u201d White Democrats granted African Americans legal freedom but\u00a0...""], ""stance"": ""Refute""}, {""question"": ""Who are the seven aspirants running for the presidency of North Macedonia, as listed in the text?"", ""search_results"": [""Apr 15, 2024 ... Who are citizens voting for on Election Day? Updated April 15, 2024. Text. Seven presidential candidates have received either the necessary\u00a0..."", ""Oct 3, 2024 ... Sweden became the latest country to join the Alliance on 7 March 2024. Currently, three partner countries have declared their aspirations to\u00a0..."", ""Overview. One Year Before the Elections. Candidates from the two main political parties the Democrats and the Republicans begin their campaign trails.""], ""stance"": ""Refute""}]}}","{""Stev\u043e Pendarovski is our European president!"": {""What is the current European president?"": ""Partially Supports"", ""Who are the candidates running for the President of North Macedonia?"": ""Refute"", ""Is Stev\u043e Pendarovski indeed the European president?"": ""Completely Supports""}, ""Let's support him with our presence at the big civil march on Monday, April 8th, at 20:00 in the park near the monument to Jane Sandanski."": {""Is the location specified for the civil march (park near the monument to Jane Sandanski) accurate?"": ""Irrelevant"", ""What is the exact date of the presidential election in North Macedonia?"": ""Irrelevant"", ""Do the presidential candidates mentioned (Biljana Vankovsk\u00ebn, Maksim Dimitrievski, and Stef\u00e7e Jakimovski) have concrete proposals for their platforms?"": ""No Evidence""}, ""On April 24th let's vote for number 1."": {""What is the date mentioned in the text as the day to vote?"": ""Partially Supports"", ""What are some promises and slogans that presidential candidates have started offering, according to the text?"": ""Refute"", ""Who are the seven aspirants running for the presidency of North Macedonia, as listed in the text?"": ""Refute""}}",Not Spreading Misinformation,"{""Completely Supports"": 1, ""Partially Supports"": 2, ""Refute"": 3, ""Irrelevant"": 2, ""No Evidence"": 1, ""Unknown"": 0}"
974847184092355,"{""Daniela Nik\u043e\u043b\u043e\u0432a presented the program of President Stevo Pendarovski to young people by the Vardar river."": {""Questions"": [{""question"": ""Did Daniela Nik\u043e\u043b\u043e\u0432a present the program of President Stevo Pendarovski to young people by the Vardar river?"", ""search_results"": [], ""stance"": ""No Evidence""}, {""question"": ""What specific attributes should the next President of North Macedonia possess, according to the dilemma dominating in the presidential election arena?"", ""search_results"": [""Global. Trends reflects the National Intelligence Council's perspective on these future trends; it does not represent the official, coordinated view of the US\u00a0..."", ""In the Democracy Report, we also distinguish between four types of regimes: Closed and Electoral Autocracies, and Electoral and Liberal. Democracies. For this,\u00a0..."", ""... vote and US elections, along with subsequent tweets by the president of the United States. New and Social Media. New and Social media provide information for\u00a0...""], ""stance"": ""Refute""}, {""question"": ""What concrete things do these candidates offer, Biljana Vankovska (64) from e Majta, Maksim Dimitrievski (48) from ZNAM, and Stef\u00e7e Jakimovski (63) from GROM?"", ""search_results"": [], ""stance"": ""No Evidence""}]}, ""The citizens are invited to join the victorious caravan of Stevo Pendarovski on April 8th at 20:00 in the park near the monument of Jane Sandanski."": {""Questions"": [{""question"": ""What is the significance of Stevo Pendarovski's victorious caravan?"", ""search_results"": [""President-elect Gordana Siljanovska Davkova (3rd L) and outgoing President Stevo Pendarovski ... Gordana und Michael Steimer from Hesse sit in their caravan\u00a0..."", ""Apr 4, 2019 ... First round of presidential election 21 April saw virtual tie between two leading candidates, pro-Western Stevo Pendarovski who is backed by\u00a0..."", ""elections are held within the regular term and presidential elections are completed until 12 May when Stevo Pendarovski's term of office ends. Both the SDSM\u00a0...""], ""stance"": ""Partially Supports""}, {""question"": ""Are the presidential candidates in North Macedonia offering a wide range of promises and slogans to attract voters?"", ""search_results"": [""Nov 7, 2018 ... Relying on the extensive scientific literature on populism, this report identifies 46 populist leaders or political parties that have held\u00a0..."", ""Jan 31, 2024 ... While media literacy training shows promise, it suffers challenges in speed, scale, and targeting. Reaching large numbers of people, including\u00a0..."", ""Apr 15, 2019 ... ... presidential elections attract far less attention than parliamentary elections. ... In pursuit of a wide spectrum of voters, opposition\u00a0...""], ""stance"": ""Irrelevant""}, {""question"": ""When did the presidential election campaign officially start in North Macedonia?"", ""search_results"": [""Feb 29, 2024 ... The official election campaign period begins 20 days before and lasts until 24 hours before election day. The holding of concurrent presidential\u00a0..."", ""Apr 15, 2024 ... On Wednesday, April 24, North Macedonia will hold presidential elections. Elections take place among political tensions within the country,\u00a0..."", ""Sep 23, 2024 ... ... presidential election was competitive, and voters had the ... Key aspects of the presidential election, such as campaign rules\u00a0...""], ""stance"": ""Partially Supports""}]}, ""We don't give up on the future!"": {""Questions"": [{""question"": ""What is the current situation with presidential candidates in North Macedonia?"", ""search_results"": [""Apr 15, 2019 ... Three candidates have received the necessary 10,000 signatures to stand for nomination for the position of president of the Republic of North\u00a0..."", ""Apr 24, 2024 ... Seven candidates will compete for the presidential position: \u25cb Stevo Pendarovski, the joint candidate of the ruling SDSM (Social Democratic\u00a0..."", ""Apr 15, 2024 ... On Wednesday, April 24, North Macedonia will hold presidential elections. Elections take place among political tensions within the country,\u00a0...""], ""stance"": ""Partially Supports""}, {""question"": ""Can you summarize the promises and slogans offered by the presidential candidates?"", ""search_results"": [""... election of 1796 would be decided by the political scheming within those assemblies. ... With Jefferson as President, so warned one newspaper, \""Murder\u00a0..."", ""Jul 8, 2024 ... It is a forward-looking Agenda that begins with the following twenty promises that we will accomplish very quickly when we win the White House\u00a0..."", ""Jun 20, 2024 ... John Oliver discusses Donald Trump's plans for a second term, why it could be much worse than his first term, and what Trump has in common\u00a0...""], ""stance"": ""Irrelevant""}, {""question"": ""What are the main characteristics that the next President of North Macedonia should possess, according to the author Enis Shaqiri?"", ""search_results"": [""Prishtina, Kosovo \u2014 May 2, 2025 \u2014 RIT Kosovo proudly announces that two of its academic programs have received the prestigious Certificate of Excellence from\u00a0..."", ""May 19, 2022 ... Republic of North Macedonia must meet two basic requirements: First ... Petrovi\u0107, in North Macedonia, another new locality was recognized."", ""May 17, 2024 ... that they have 3-4 meals a day (diabetics should have 3 main meals ... In the Republic of Northern Macedonia, according to the latest.""], ""stance"": ""Partially Supports""}]}}","{""Daniela Nik\u043e\u043b\u043e\u0432a presented the program of President Stevo Pendarovski to young people by the Vardar river."": {""Did Daniela Nik\u043e\u043b\u043e\u0432a present the program of President Stevo Pendarovski to young people by the Vardar river?"": ""No Evidence"", ""What specific attributes should the next President of North Macedonia possess, according to the dilemma dominating in the presidential election arena?"": ""Refute"", ""What concrete things do these candidates offer, Biljana Vankovska (64) from e Majta, Maksim Dimitrievski (48) from ZNAM, and Stef\u00e7e Jakimovski (63) from GROM?"": ""No Evidence""}, ""The citizens are invited to join the victorious caravan of Stevo Pendarovski on April 8th at 20:00 in the park near the monument of Jane Sandanski."": {""What is the significance of Stevo Pendarovski's victorious caravan?"": ""Partially Supports"", ""Are the presidential candidates in North Macedonia offering a wide range of promises and slogans to attract voters?"": ""Irrelevant"", ""When did the presidential election campaign officially start in North Macedonia?"": ""Partially Supports""}, ""We don't give up on the future!"": {""What is the current situation with presidential candidates in North Macedonia?"": ""Partially Supports"", ""Can you summarize the promises and slogans offered by the presidential candidates?"": ""Irrelevant"", ""What are the main characteristics that the next President of North Macedonia should possess, according to the author Enis Shaqiri?"": ""Partially Supports""}}",Not Spreading Misinformation,"{""Completely Supports"": 0, ""Partially Supports"": 4, ""Refute"": 1, ""Irrelevant"": 2, ""No Evidence"": 2, ""Unknown"": 0}"
393434320275374,"{""For more information, follow us."": {""Questions"": [{""question"": ""What is the specific information that the candidates are promising to voters?"", ""search_results"": [""Feb 2, 2022 ... She details that not only do voters understand the difference between a general policy stance and a specific ... Campus Emergency Information\u00a0..."", ""A donor asks a friend to give money to a federal candidate, promising to ... A voter intentionally gives false information when registering to vote; A\u00a0..."", ""| Check your county elections website for voting information and polling ... particular political party to vote for a candidate from that party. Texas\u00a0...""], ""stance"": ""Irrelevant""}, {""question"": ""What are the slogans and promises being offered by the presidential candidates?"", ""search_results"": [""Aug 7, 2024 ... ... Republican presidential nominee is promising ... Context: This promise echoes the official Republican party platform of securing elections\u00a0..."", ""While the vice president received only two electoral votes south of the Potomac, Jefferson won only eighteen votes outside of the South, thirteen of which came\u00a0..."", ""Chase Oliver is a Libertarian Party activist who ran in the 2022 US Senate race in Georgia. Oliver announced his candidacy for the 2024 presidential election\u00a0...""], ""stance"": ""Irrelevant""}, {""question"": ""What is the current situation regarding the presidential election in North Macedonia, specifically with regards to the number of aspirants and their backgrounds?"", ""search_results"": [""Oct 30, 2024 ... ... regard as a number of middle management staff ... and presidential election period, based on a public notice issued by the State Commission."", ""... their stance on issues and policies against other candidates. Then the ... state's population cast their vote and determine who will be president. Each\u00a0..."", ""North Macedonia launched its accession talks with the European Union on July 19, 2022, by holding the inaugural EU-Macedonian intergovernmental conference.""], ""stance"": ""Refute""}]}}","{""For more information, follow us."": {""What is the specific information that the candidates are promising to voters?"": ""Irrelevant"", ""What are the slogans and promises being offered by the presidential candidates?"": ""Irrelevant"", ""What is the current situation regarding the presidential election in North Macedonia, specifically with regards to the number of aspirants and their backgrounds?"": ""Refute""}}",Spreading Misinformation,"{""Completely Supports"": 0, ""Partially Supports"": 0, ""Refute"": 1, ""Irrelevant"": 2, ""No Evidence"": 0, ""Unknown"": 0}"
1168755624286124,"{""We discussed the new program of SDSM with President Dimitar Kovachevski and Andrej Petrov, which includes bigger salaries and pensions, more investments, more and better jobs, and a developed economy according to European standards."": {""Questions"": [{""question"": ""Is the new program discussed by SDSM with President Dimitar Kovachevski and Andrej Petrov specifically focused on increasing salaries, pensions, investments, jobs, and economic development to European standards?"", ""search_results"": [""Research classified by Journal of Economic Literature (JEL) codes. Top JEL / L: Industrial Organization / / L2: Firm Objectives, Organization, and Behavior.""], ""stance"": ""Refute""}, {""question"": ""Are there any notable differences in the promises made by the seven presidential candidates in the North Macedonia election?"", ""search_results"": [""May 8, 2024 ... Elections FAQs: Parliamentary Election in North Macedonia. Page 7 ... an Election Observation Mission for presidential and parliamentary elections\u00a0..."", ""Feb 16, 2020 ... North Macedonia, Presidential Election ... 22 December parliamentary elections were an important milestone but that there is need for further\u00a0..."", ""Mar 27, 2023 ... In the 2016 presidential election ... an opposition candidate who promised to undertake democratizing reforms, including freeing political\u00a0...""], ""stance"": ""No Evidence""}, {""question"": ""What specific policies or initiatives are being offered by each of the seven presidential candidates in the North Macedonia election?"", ""search_results"": [""Apr 15, 2024 ... Voting will be organized the day before Election Day for voters who are homebound due to incapacity or illness; confined to prison, other\u00a0..."", ""UPCOMING ELECTIONS. 2025 May Primary/Special Election. May 6, 2025. The Registration Deadline for the May 6, 2025 Primary/Special Election is Monday, April 7,\u00a0..."", ""The electoral system in the U.S. is called a two-party system. That means that two parties dominate the political field in all three levels of government. In\u00a0...""], ""stance"": ""Refute""}]}, ""Our president Stevo Pendarovski also shares this vision with us, together we will achieve our goal - Macedonia as an EU member!"": {""Questions"": [{""question"": ""What is the current president's name according to the text?"", ""search_results"": [""Any new major under an existing degree name. d. Approval of New Academic ... does not apply, the chief executive officer of the state university shall recommend\u00a0..."", ""Jan 11, 1989 ... It's been the honor of my life to be your President. So many of you have written the past few weeks to say thanks, but I could say as much to\u00a0..."", ""... according to the particular circumstances of each territory and its peoples ... such of those Members mentioned by name in Article 23 as are not administering\u00a0...""], ""stance"": ""Refute""}, {""question"": ""Who are the 7 aspirants competing for the presidential post in the election?"", ""search_results"": [""Candidates & Referendums \u00b7 June 17, 2025 Primary Elections \u00b7 November 4, 2025 General Elections candidate lists will be posted the week of June 30th. \u00b7 November 4,\u00a0..."", ""Sep 16, 2024 ... Seven candidates announced for IOC presidency \u00b7 HRH Prince Feisal AL HUSSEIN \u00b7 Lord Sebastian COE \u00b7 Mrs Kirsty COVENTRY \u00b7 Mr Johan ELIASCH \u00b7 Mr\u00a0..."", ""Presidential election, 2024. Candidate/Running mate. %. Popular votes. Electoral votes.""], ""stance"": ""Refute""}, {""question"": ""Do any of the candidates mentioned offer a specific attribute they think the next President of North Macedonia should have?"", ""search_results"": [""3 days ago ... The American people tapped President Donald Trump to represent them in this historic endeavor. And with that, I will take as many of your\u00a0..."", ""Sep 22, 2024 ... \u201cThe future is not distant,\u201d stressed Nana Addo Dankwa Akufo-Addo, President of Ghana \u2014 \u201cit is here, and the choices we make here will determine\u00a0..."", ""Oct 3, 2024 ... NATO's door remains open to any European country in a position to undertake the commitments and obligations of membership, and contribute to\u00a0...""], ""stance"": ""Refute""}]}, ""We are not giving up on the future!"": {""Questions"": [{""question"": ""What is the current state of the presidential election in North Macedonia?"", ""search_results"": [""Presidential elections were held in North Macedonia on 24 April 2024. Incumbent Stevo Pendarovski of the ruling centre-left Social Democrats ran for\u00a0..."", ""Apr 24, 2024 ... IFIMES has prepared an analysis of the current political situation in the Republic of North Macedonia ahead of the first round of\u00a0..."", ""Dec 19, 2024 ... direct presidential elections held worldwide. These women leaders represent Iceland, Mexico, Namibia, North Macedonia, and the Republic of\u00a0...""], ""stance"": ""Partially Supports""}, {""question"": ""What are the key promises and slogans being offered by the candidates?"", ""search_results"": [""Mar 2, 2022 ... The John F. Kennedy Presidential Library and Museum is closed on Sunday, May 4, and will reopen on Monday, May 5. Dismiss\u00a0..."", ""... slogans \u2022 Key staffers \u2022 Vice presidential candidates \u2022 Policy positions \u2022 Ballotpedia's presidential election coverage index. Primaries. Democratic\u00a0..."", ""... gave him national standing above all other candidates. It also helped that ... been finalized\u2014surprisingly backfired as an election strategy. It\u00a0...""], ""stance"": ""Irrelevant""}, {""question"": ""What are the main differences between the seven presidential aspirants vying for office?"", ""search_results"": [""For district and state offices appearing on the primary election ballot, it is the state party chair. For independent or write-in candidates for county level\u00a0..."", ""Notable Differences: Corinne Roosevelt Robinson highlighted significant differences between the two major parties in ... difference between the two candidates."", ""Aug 18, 2020 ... ... presidency in every presidential race since 1964 lends ... First on March 17 in the state primary, when they consider candidates competing\u00a0...""], ""stance"": ""Irrelevant""}]}}","{""We discussed the new program of SDSM with President Dimitar Kovachevski and Andrej Petrov, which includes bigger salaries and pensions, more investments, more and better jobs, and a developed economy according to European standards."": {""Is the new program discussed by SDSM with President Dimitar Kovachevski and Andrej Petrov specifically focused on increasing salaries, pensions, investments, jobs, and economic development to European standards?"": ""Refute"", ""Are there any notable differences in the promises made by the seven presidential candidates in the North Macedonia election?"": ""No Evidence"", ""What specific policies or initiatives are being offered by each of the seven presidential candidates in the North Macedonia election?"": ""Refute""}, ""Our president Stevo Pendarovski also shares this vision with us, together we will achieve our goal - Macedonia as an EU member!"": {""What is the current president's name according to the text?"": ""Refute"", ""Who are the 7 aspirants competing for the presidential post in the election?"": ""Refute"", ""Do any of the candidates mentioned offer a specific attribute they think the next President of North Macedonia should have?"": ""Refute""}, ""We are not giving up on the future!"": {""What is the current state of the presidential election in North Macedonia?"": ""Partially Supports"", ""What are the key promises and slogans being offered by the candidates?"": ""Irrelevant"", ""What are the main differences between the seven presidential aspirants vying for office?"": ""Irrelevant""}}",Spreading Misinformation,"{""Completely Supports"": 0, ""Partially Supports"": 1, ""Refute"": 5, ""Irrelevant"": 2, ""No Evidence"": 1, ""Unknown"": 0}"
