ad_archive_id,claims_to_questions,stance_results,verdict,stance_counts
988735132879405,"{""There is no giving up on destiny"": {""Questions"": [{""question"": ""Is the claim that 'There is no giving up on destiny' a statement about the upcoming presidential election in North Macedonia?"", ""search_results"": [""Then it occurred to us that Birmingham's mayoral election was coming up in ... Lamentably, it is an historical fact that privileged groups seldom give up their\u00a0..."", ""Feb 21, 2022 ... ... North Macedonia in 2020. As a result, the Alliance, its military ... As we say, there is no end in sight to this. Meanwhile, the so\u00a0..."", ""Jan 21, 2025 ... I return to the presidency confident and optimistic that we are at the start of a thrilling new era of national success. A tide of change is\u00a0...""], ""stance"": ""Unknown""}, {""question"": ""What are the main promises and slogans being offered by the presidential candidates, as stated in the article?"", ""search_results"": [""Aug 7, 2024 ... We take a focused look at what the Republican presidential nominee is promising right now on the campaign trail."", ""Jefferson approached the 1800 presidential election well organized for victory and determined to win. ... Given the intense rivalry and conflict involved, it is\u00a0..."", ""Mar 2, 2022 ... John F. Kennedy was elected president in one of the closest elections in United States history. Kennedy's popular vote margin over Nixon was\u00a0...""], ""stance"": ""Partially Supports""}, {""question"": ""Do any of the seven aspirants running for president have specific attributes or qualifications mentioned in the article?"", ""search_results"": [""... any statute of the United States or any Executive order of the President; and. (2) such individual has not fulfilled or has ceased to fulfill that requirement."", ""State residency requirements range from no formal provision to 7 years. ... In some states appointed boards have the primary responsibility for individual\u00a0..."", ""Jun 29, 2023 ... Harvard College and the University of North Carolina (UNC) are two of the oldest institutions of higher learning in the United States. Every.""], ""stance"": ""Refute""}]}, ""SDSM"": {""Questions"": [{""question"": ""How many presidential candidates are running in the North Macedonia election?"", ""search_results"": [""SKOPJE, 9 May 2024 \u2013 North Macedonia's presidential run-off and parliamentary elections were competitive and an extensive and pluralistic campaign helped\u00a0..."", ""Apr 25, 2024 ... North Macedonia's right-wing candidate Gordana Siljanovska-Davkova claimed a comprehensive victory in the first round of presidential elections on Wednesday."", ""Apr 15, 2024 ... If no candidate wins the majority of votes on Election Day, a second round of elections will be held on May 8 for the two candidates who\u00a0...""], ""stance"": ""Completely Supports""}, {""question"": ""What is the primary focus of the presidential candidates' campaigns (promises and slogans)?"", ""search_results"": [""... President for breaking his 1988 campaign promise not to ... The 1992 presidential campaign focused primarily on domestic issues, specifically the economy."", ""Mar 2, 2022 ... John F. Kennedy was elected president in one of the closest elections in United States history. Kennedy's popular vote margin over Nixon was\u00a0..."", ""The Campaign and Election of 1912 ... Although Woodrow Wilson was convinced that God had destined him to be president, it took all his political skill and a good\u00a0...""], ""stance"": ""Irrelevant""}, {""question"": ""What are the key qualifications or attributes that the next President of North Macedonia should possess, according to the claim?"", ""search_results"": [""We offer this analysis with humility, knowing that invariably the future will unfold in ways that we have not foreseen. Although Global Trends is necessarily\u00a0..."", ""should be authenticated by the council president and village clerk. 4. (Q) ... The claim shall specify the property affected and the amount of damages."", ""Nov 5, 2021 ... The John F. Kennedy Presidential Library and Museum is closed on Sunday, May 4, and will reopen on Monday, May 5. Dismiss\u00a0...""], ""stance"": ""Irrelevant""}]}, ""Aerodrome"": {""Questions"": [{""question"": ""Is the claim that the President-elect of North Macedonia should possess certain attributes a verifiable fact?"", ""search_results"": [""Jan 31, 2024 ... Policymakers can have some confidence that fact-checking is worthy of investment. ... fact-checks should repeat the false claim being\u00a0..."", ""PEPs and civil servants who do not declare assets. A reason for concern presents the fact that some PEPs, as well as other categories of civil servants, are not\u00a0..."", ""Biometric identification consists of determining the identity of a person. The aim is to capture an item of biometric data from this person. It can be a photo\u00a0...""], ""stance"": ""Irrelevant""}, {""question"": ""What are the specific promises and slogans being offered by the presidential candidates mentioned in the article?"", ""search_results"": [""... political cartoons and newspaper articles, swept over the land. It was in ... Given the intense rivalry and conflict involved, it is not surprising\u00a0..."", ""Mar 2, 2022 ... John F. Kennedy was elected president in one of the closest elections in United States history. Kennedy's popular vote margin over Nixon was\u00a0..."", ""In a private meeting, Truman proposed that he and Eisenhower run together on the Democratic ticket, with Eisenhower as the presidential candidate and Truman in\u00a0...""], ""stance"": ""Irrelevant""}, {""question"": ""Are there indeed seven presidential aspirants vying for the position, including Biljana Vankovsk\u00ebn, Maksim Dimitrievski, and Stef\u00e7e Jakimovski?"", ""search_results"": [], ""stance"": ""Irrelevant""}]}, ""Macedonia"": {""Questions"": [{""question"": ""What is the exact date when the presidential election campaign in North Macedonia started?"", ""search_results"": [""Apr 15, 2024 ... The president serves a five-year term and is elected by an absolute majority vote through a two-round system (see \u201cWhen is Election Day?\u201d). In a\u00a0..."", ""May 9, 2024 ... ... North Macedonia's presidential run-off and parliamentary elections ... At the same time, the transparency and accountability of campaign\u00a0..."", ""Apr 24, 2024 ... ... general election due in two weeks' time. Polling stations opened on Wednesday in the presidential election in North Macedonia, the country's\u00a0...""], ""stance"": ""Partially Supports""}, {""question"": ""What are the specific promises and slogans offered by the candidates Biljana Vankovsk\u00eb, Maksim Dimitrievski, and Stef\u00e7e Jakimovski?"", ""search_results"": [], ""stance"": ""No Evidence""}, {""question"": ""What is the main dilemma currently dominating the presidential election scene in North Macedonia?"", ""search_results"": [""... presidential election is scheduled. Free and fair elections. '06 '24 10 1 ... primary political parties in North Macedonia. SDSM is a reformed social\u00a0..."", ""Jun 10, 2024 ... ... presidential elections, becoming the country's first female president. ... A huge statue of Alexander the Great dominates Skopje's central square\u00a0..."", ""... elections, and Nikoli\u0107 was elected president in 2012. Since then, Aleksandar Vu\u010di\u0107, at the helm of SNS, has dominated the Serbian political scene. Between\u00a0...""], ""stance"": ""Partially Supports""}]}}","{""There is no giving up on destiny"": {""Is the claim that 'There is no giving up on destiny' a statement about the upcoming presidential election in North Macedonia?"": ""Unknown"", ""What are the main promises and slogans being offered by the presidential candidates, as stated in the article?"": ""Partially Supports"", ""Do any of the seven aspirants running for president have specific attributes or qualifications mentioned in the article?"": ""Refute""}, ""SDSM"": {""How many presidential candidates are running in the North Macedonia election?"": ""Completely Supports"", ""What is the primary focus of the presidential candidates' campaigns (promises and slogans)?"": ""Irrelevant"", ""What are the key qualifications or attributes that the next President of North Macedonia should possess, according to the claim?"": ""Irrelevant""}, ""Aerodrome"": {""Is the claim that the President-elect of North Macedonia should possess certain attributes a verifiable fact?"": ""Irrelevant"", ""What are the specific promises and slogans being offered by the presidential candidates mentioned in the article?"": ""Irrelevant"", ""Are there indeed seven presidential aspirants vying for the position, including Biljana Vankovsk\u00ebn, Maksim Dimitrievski, and Stef\u00e7e Jakimovski?"": ""Irrelevant""}, ""Macedonia"": {""What is the exact date when the presidential election campaign in North Macedonia started?"": ""Partially Supports"", ""What are the specific promises and slogans offered by the candidates Biljana Vankovsk\u00eb, Maksim Dimitrievski, and Stef\u00e7e Jakimovski?"": ""No Evidence"", ""What is the main dilemma currently dominating the presidential election scene in North Macedonia?"": ""Partially Supports""}}",Not Spreading Misinformation,"{""Completely Supports"": 1, ""Partially Supports"": 3, ""Refute"": 1, ""Irrelevant"": 5, ""No Evidence"": 1, ""Unknown"": 1}"
1138731707263665,"{""SVM is the only party prepared to fight for citizens and the future of the state."": {""Questions"": [{""question"": ""What is the basis for the claim that SVM is the only party prepared to fight for citizens and the future of the state?"", ""search_results"": [""... citizen, or intended citizen, who had never borne arms against the U.S. government could claim 160 acres of surveyed government land. Claimants were\u00a0..."", ""This form will be used by the United States (U.S.) Government in conducting background investigations, reinvestigations, and continuous evaluations of."", ""Oct 1, 2024 ... (c) The state has a claim against a county assessor-collector and the sureties on the ... (2) is operated only temporarily on a highway of this\u00a0...""], ""stance"": ""Refute""}, {""question"": ""How do the presidential candidates plan to address the concerns of the electorate?"", ""search_results"": [""... elections). Where can I find the names and voting records of presidential electors for all previous Presidential elections back to 1789? OFR is not aware of\u00a0..."", ""Nov 29, 2023 ... ... presidential election. But young people are also living ... In all of our work, we are especially concerned with understanding, addressing\u00a0..."", ""Oct 23, 2024 ... Thus far neither candidate has put forward a plan to address or $35 trillion national debt. ... President Trump's plan would increase the debt by\u00a0...""], ""stance"": ""Refute""}, {""question"": ""What specific policies or actions do the seven aspirants promise to implement if elected as President?"", ""search_results"": [""... promising benefits if they forget about the union. Section 7 of the National Labor Relations Act (the Act) guarantees employees \""the right to self\u00a0..."", ""Jan 14, 2025 ... Vice President-elect JD Vance has promised to \u201cstop doing mass grants of Temporary Protected Status\u201d (TPS). Thus, the incoming Trump\u00a0..."", ""Nov 6, 2024 ... ... promised action on issues including immigration, the economy and the war in Ukraine. He looks likely to enjoy plenty of support for his\u00a0...""], ""stance"": ""Refute""}]}, ""We are united and strong, we have endured time and weather, good and bad, and always been on the guard of the homeland."": {""Questions"": [{""question"": ""What is the main topic discussed in the article?"", ""search_results"": [""A MeSH Major Topic is one of the main topics discussed in an article. In the list of MeSH Headings assigned to a citation that appear in the PubMed record,\u00a0..."", ""Textbook chapters, articles, paragraphs, sentences, or passages all have topics and main ideas. ... presented and discussed, these longer writings contain\u00a0..."", ""Feb 4, 2025 ... In this article ... This is why feedback (when to solicit it and when to give it) is such an important mentoring discussion topic for mentors and\u00a0...""], ""stance"": ""Irrelevant""}, {""question"": ""Who are the presidential candidates mentioned in the article, and what parties do they belong to?"", ""search_results"": [""Overview. One Year Before the Elections. Candidates from the two main political parties the Democrats and the Republicans begin their campaign trails. They\u00a0..."", ""Aug 22, 2024 ... ... parties choose presidential nominees ... At the end, the number of delegates given to each candidate is based on the number of caucus votes they\u00a0..."", ""Aug 22, 2024 ... But when he announced he was stepping aside, party rules freed the Democratic delegates to choose another candidate. Though the delegates were\u00a0...""], ""stance"": ""Refute""}, {""question"": ""What is the central question being asked about the future president of North Macedonia?"", ""search_results"": [""... been nominated by SDSM for the 2019 presidential election. North Macedonia ... This issue has become a key rallying cry for the populist opposition party, Levica."", ""Oct 3, 2024 ... ... for membership have been met. ... Albania and Croatia joined the Alliance in April 2009; Montenegro in June 2017; and the Republic of North\u00a0..."", ""... future Republic of North Macedonia to Serbia. ... In the same poll, 84% of the respondents were pro-veto in the country's NATO accession talks, if the issue had\u00a0...""], ""stance"": ""Refute""}]}, ""It's not an option for us to give up. We're a party made of solid material."": {""Questions"": [{""question"": ""What does 'solid material' mean in the context of a political party?"", ""search_results"": [""(E) are processed or held prior to processing at an advanced recycling facility. (25) \""Processing\"" means the extraction of materials from or the transfer,\u00a0..."", ""Recovered material means waste materials and by-products recovered or diverted from solid ... (2) In this context, the term does not mean that the source\u00a0..."", ""We have made clear that the leadership of the Communist Party of China is the defining feature of socialism with Chinese characteristics and the greatest\u00a0...""], ""stance"": ""Refute""}, {""question"": ""Are there any specific requirements or attributes that the next President of North Macedonia should possess, according to the author?"", ""search_results"": [""Introducing new generations of friends and family members to hunting is an important part of the experience. With that in mind, the. Illinois Department of\u00a0..."", ""Jan 12, 2023 ... Kosovo, North Macedonia and Montenegro have been mostly in line with Western democracies. ... While no country in the region exhibits high\u00a0..."", ""We offer this analysis with humility, knowing that invariably the future will unfold in ways that we have not foreseen. Although Global Trends is necessarily\u00a0...""], ""stance"": ""Irrelevant""}, {""question"": ""What is the main difference between the candidates (Biljana Vankovsk\u00eb, Maksim Dimitrievski, and Stef\u00e7e Jakimovski) in terms of their promises and slogans?"", ""search_results"": [], ""stance"": ""No Evidence""}]}}","{""SVM is the only party prepared to fight for citizens and the future of the state."": {""What is the basis for the claim that SVM is the only party prepared to fight for citizens and the future of the state?"": ""Refute"", ""How do the presidential candidates plan to address the concerns of the electorate?"": ""Refute"", ""What specific policies or actions do the seven aspirants promise to implement if elected as President?"": ""Refute""}, ""We are united and strong, we have endured time and weather, good and bad, and always been on the guard of the homeland."": {""What is the main topic discussed in the article?"": ""Irrelevant"", ""Who are the presidential candidates mentioned in the article, and what parties do they belong to?"": ""Refute"", ""What is the central question being asked about the future president of North Macedonia?"": ""Refute""}, ""It's not an option for us to give up. We're a party made of solid material."": {""What does 'solid material' mean in the context of a political party?"": ""Refute"", ""Are there any specific requirements or attributes that the next President of North Macedonia should possess, according to the author?"": ""Irrelevant"", ""What is the main difference between the candidates (Biljana Vankovsk\u00eb, Maksim Dimitrievski, and Stef\u00e7e Jakimovski) in terms of their promises and slogans?"": ""No Evidence""}}",Spreading Misinformation,"{""Completely Supports"": 0, ""Partially Supports"": 0, ""Refute"": 6, ""Irrelevant"": 2, ""No Evidence"": 1, ""Unknown"": 0}"
1462600661315120,"{""SVM is the only party ready to fight for citizens and for the future of the state."": {""Questions"": [{""question"": ""What is the specific attribute that the next President of North Macedonia should possess?"", ""search_results"": [""Jan 12, 2023 ... In the tripartite presidency of BiH, Republika Srpska's president ... Kosovo, North Macedonia and Montenegro have been mostly in line with Western\u00a0..."", ""Feb 26, 2021 ... The 22-member committee has identified eight attributes they believe a successful candidate will have. \u201cIf we can find a candidate who checks\u00a0..."", ""Rapidly reducing methane emissions from energy, agriculture, and waste can achieve near-term gains in our efforts in this decade for decisive action and is\u00a0...""], ""stance"": ""Refute""}, {""question"": ""How do the candidates plan to achieve their promises and slogans during the election campaign?"", ""search_results"": [""Mar 2, 2022 ... ... would tell his parishioners for whom to vote.\"" But anti-Catholic ... on behalf of Republican candidates. Several key states seemed to\u00a0..."", ""Both Nellie Taft and Roosevelt had to persuade Taft to make the race. Even with the presidency in his reach, Taft much preferred the U.S. Supreme Court chief\u00a0..."", ""Oct 23, 2024 ... Dumbledore promises to accomplish so much during his term as Mayor of ... Her campaign slogan is, \u201cLet's Make Paws-itive Change Together!""], ""stance"": ""Refute""}, {""question"": ""Can SVM's claim that it is the only party ready to fight for citizens and the future of the state be supported or refuted by concrete actions taken by the party?"", ""search_results"": [""Mar 1, 2024 ... Statement bias, also called presentation bias, refers to how articles choose to inform about certain entities/concepts. This can be done through\u00a0..."", ""Oct 1, 2024 ... (c) The state has a claim against a county assessor-collector and the ... therefore, the vehicle weight can only be increased by 6,000 lbs."", ""These poems were written during Lockdown and the Covid pandemic at a time when it seemed the whole country was going through a crisis.""], ""stance"": ""Refute""}]}, ""We are united and strong, we have endured time and weather, good and bad, and we have always been on the barricades for the homeland."": {""Questions"": [{""question"": [""The statement 'We are united and strong...' is a claim made by whom?"", ""Who are the presidential candidates in North Macedonia's election?"", ""What specific attributes should the next President of North Macedonia possess, according to the author?""], ""search_results"": [""Jul 2, 2024 ... The FTC Act gives the Commission the power to bring law enforcement actions against false or misleading claims that a product is of US origin."", ""Dec 7, 2020 ... It was 70 years ago that the United States, under President Truman, recognized the State of Israel. Ever since then, Israel has made its capital\u00a0..."", ""The Commission also issued an Enforcement Policy. Statement on U.S. Origin Claims to provide guidance to marketers who want to make an unqualified Made in USA.""], ""stance"": ""Refute""}]}, ""The SVM party is made of tough material. Renunciation is not an option for us."": {""Questions"": [{""question"": ""What does 'tough material' mean in the context of the SVM party?"", ""search_results"": [""May 1, 2022 ... Anomalous behaviour in credit card data can signify identity theft or fraudulent transactions committed by an unauthorized party (Singh &\u00a0..."", ""Sep 24, 2021 ... Possibly also the ability to convey ideas/meaning back to them, even if you can't speak their language. Basically the idea is that words convey\u00a0..."", ""Background. 2.1. Historical perspective of privacy in medicine. The process of maintaining the security and confidentiality of patient records is known as\u00a0...""], ""stance"": ""Refute""}, {""question"": ""What are the main pledges and slogans being offered by presidential candidates?"", ""search_results"": [""... Logos and slogans \u2022 Key staffers \u2022 Vice presidential candidates \u2022 Policy positions \u2022 Ballotpedia's presidential election coverage index. Primaries. Democratic\u00a0..."", ""This position gave Carter access to key Democrats ... It was the first loss by an elected presidential incumbent since Hoover had been defeated in 1932."", ""A candidate is typically only eligible to receive a share of the pledged delegates at stake if they win at least 15 percent of votes cast in a primary or caucus\u00a0...""], ""stance"": ""Refute""}, {""question"": ""What specific qualities or attributes should the next President of North Macedonia possess, according to Enis Shaqiri?"", ""search_results"": [""May 17, 2024 ... with a specific emphasis on North Macedonia. Drawing on data from ... In the Republic of Northern Macedonia, according to the latest."", ""May 19, 2023 ... The nutritive traits of Pimpinella anisum L were analyzed 15 days before harvest and 3 months after storage at room temperature, under +4 o C and at -18 o C."", ""The proposed unified repository architecture should have the following characteristics: o Open: will ... To reach this goal specific physical-chemical attributes\u00a0...""], ""stance"": ""Irrelevant""}]}}","{""SVM is the only party ready to fight for citizens and for the future of the state."": {""What is the specific attribute that the next President of North Macedonia should possess?"": ""Refute"", ""How do the candidates plan to achieve their promises and slogans during the election campaign?"": ""Refute"", ""Can SVM's claim that it is the only party ready to fight for citizens and the future of the state be supported or refuted by concrete actions taken by the party?"": ""Refute""}, ""We are united and strong, we have endured time and weather, good and bad, and we have always been on the barricades for the homeland."": {""The statement 'We are united and strong...' is a claim made by whom?"": ""Refute""}, ""The SVM party is made of tough material. Renunciation is not an option for us."": {""What does 'tough material' mean in the context of the SVM party?"": ""Refute"", ""What are the main pledges and slogans being offered by presidential candidates?"": ""Refute"", ""What specific qualities or attributes should the next President of North Macedonia possess, according to Enis Shaqiri?"": ""Irrelevant""}}",Spreading Misinformation,"{""Completely Supports"": 0, ""Partially Supports"": 0, ""Refute"": 6, ""Irrelevant"": 1, ""No Evidence"": 0, ""Unknown"": 0}"
