ad_archive_id,claims_to_questions,stance_results,verdict,stance_counts
446303441400950,"{""Sijanovska is fully in the matrix of DPMNE and incites harm towards Pendarevski and Kovachevski."": {""Questions"": [{""question"": ""What evidence is there to support the claim that Sijanovska is fully in the matrix of DPMNE?"", ""search_results"": [], ""stance"": ""No Evidence""}, {""question"": ""Are Pendarevski and Kovachevski public figures or politicians who have been subject to harm incited by Sijanovska?"", ""search_results"": [], ""stance"": ""No Evidence""}, {""question"": ""Do the presidential candidates mentioned (Vankovsk\u00ebn, Dimitrievski, and Jakimovski) have a clear platform and specific promises they are offering to voters?"", ""search_results"": [], ""stance"": ""No Evidence""}]}, ""Personal discreditations for people with a female gender, harms to intellectual capacities expressed by Sijanovska do not apply to professors or politicians."": {""Questions"": [{""question"": ""What specific evidence or data does the claim provide to support the idea that personal discreditations for people with a female gender do not apply to professors or politicians?"", ""search_results"": [""It has been argued that the treatment of gender-related asylum claims as special ... The claim that women can say no to FGC further reflects interviewers\u00a0..."", ""Apr 24, 2019 ... ... does it have to provide evidence and facts to support its opposition. Instead, the gun rights group can claim that freedom and fundamental\u00a0..."", ""Jul 1, 2024 ... Experts are studying how false information spreads, who is most vulnerable, and how to end the 'infodemic.'""], ""stance"": ""Irrelevant""}, {""question"": ""How is it possible that Sijanovska's findings on intellectual capacities being harmed by personal discreditations only apply to individuals outside of academia and politics, if they are based on scientific research?"", ""search_results"": [], ""stance"": ""No Evidence""}, {""question"": ""What is the main argument or logic behind the claim that personal discreditations for people with a female gender do not harm their intellectual capacities in the context of professors and politicians?"", ""search_results"": [""Apr 24, 2019 ... The National Rifle Association uses messaging strategies employed by dictators and demagogues to advance its gun rights narrative within the United States."", ""Over and over again, she has uncovered denials of the right to legal capacity that are uniquely experienced by women, disabled women, or gender minorities (\u00a0..."", ""Deepfake technology is an evolution of generative networks in adversarial training, which involves training an artificial intelligence (AI) system by\u00a0...""], ""stance"": ""Refute""}]}, ""Mistakes are about representing a vision, offering something to citizens, rather than inciting harm and personal discreditations."": {""Questions"": [{""question"": ""What does the speaker mean by 'Mistakes are about representing a vision, offering something to citizens, rather than inciting harm and personal discreditations.'?"", ""search_results"": [""Mar 19, 2023 ... ... can all enjoy our human rights. Our vision is of a world where those in power keep their promises, respect international law and are held to."", ""Miros\u0142aw Karwat is a professor at the Faculty of Political Science and Interna- tional Studies at the University of Warsaw, Poland. He specializes in political."", ""Mar 28, 2023 ... This article examines what a Royal Commission of. Inquiry on Illegal Immigrants in Sabah has called. \u201can insidious problem which has turned out\u00a0...""], ""stance"": ""Irrelevant""}, {""question"": ""What is the main concern in the Macedonian presidential election campaign according to the author?"", ""search_results"": [""Jun 15, 2005 ... ... presidential campaign. Macedonia's rating for independent media ... Macedonia held extraordinary presidential elections in April. Since\u00a0..."", ""Dec 15, 2016 ... Macedonia held elections on 11 December which took place against the backdrop of a major political crisis. Misha Popovikj assesses the\u00a0..."", ""Aug 25, 2020 ... Many of the most viral posts originated from Veles, a small town in central Macedonia. During fieldwork in Veles, where we interviewed several residents and\u00a0...""], ""stance"": ""Partially Supports""}, {""question"": ""What specific promises do the presidential candidates Biljana Vankovska, Maksim Dimitrievski, and Stef\u00e7e Jakimovski offer?"", ""search_results"": [], ""stance"": ""No Evidence""}]}}","{""Sijanovska is fully in the matrix of DPMNE and incites harm towards Pendarevski and Kovachevski."": {""What evidence is there to support the claim that Sijanovska is fully in the matrix of DPMNE?"": ""No Evidence"", ""Are Pendarevski and Kovachevski public figures or politicians who have been subject to harm incited by Sijanovska?"": ""No Evidence"", ""Do the presidential candidates mentioned (Vankovsk\u00ebn, Dimitrievski, and Jakimovski) have a clear platform and specific promises they are offering to voters?"": ""No Evidence""}, ""Personal discreditations for people with a female gender, harms to intellectual capacities expressed by Sijanovska do not apply to professors or politicians."": {""What specific evidence or data does the claim provide to support the idea that personal discreditations for people with a female gender do not apply to professors or politicians?"": ""Irrelevant"", ""How is it possible that Sijanovska's findings on intellectual capacities being harmed by personal discreditations only apply to individuals outside of academia and politics, if they are based on scientific research?"": ""No Evidence"", ""What is the main argument or logic behind the claim that personal discreditations for people with a female gender do not harm their intellectual capacities in the context of professors and politicians?"": ""Refute""}, ""Mistakes are about representing a vision, offering something to citizens, rather than inciting harm and personal discreditations."": {""What does the speaker mean by 'Mistakes are about representing a vision, offering something to citizens, rather than inciting harm and personal discreditations.'?"": ""Irrelevant"", ""What is the main concern in the Macedonian presidential election campaign according to the author?"": ""Partially Supports"", ""What specific promises do the presidential candidates Biljana Vankovska, Maksim Dimitrievski, and Stef\u00e7e Jakimovski offer?"": ""No Evidence""}}",Spreading Misinformation,"{""Completely Supports"": 0, ""Partially Supports"": 1, ""Refute"": 1, ""Irrelevant"": 2, ""No Evidence"": 5, ""Unknown"": 0}"
413936974576258,"{""The airport is with President Stevo Pendarovski"": {""Questions"": [{""question"": ""What is the relationship between the airport and President Stevo Pendarovski?"", ""search_results"": [""Oct 5, 2019 ... ... with the President Stevo Pendarovski. \u201cUSA is our strategic partner ... to work together to further deepen our relations and cooperation."", ""May 26, 2021 ... President Stevo Pendarovski welcomed today the President of the Republic of Bulgaria, Rumen Radev, at the Skopje International Airport."", ""Jun 16, 2021 ... ... Stevo Pendarovski [R] at Skopje airport on May 26, 2021. Photo ... They are to meet Bulgarian President Rumen Radev, caretaker Prime\u00a0...""], ""stance"": ""Completely Supports""}, {""question"": ""In what ways do the presidential candidates differ in their promises and slogans?"", ""search_results"": [""Jul 31, 2017 ... ... different, it can be really confusing.\"" The researchers examined how presidential candidates used words together \u2014 word association \u2014 in\u00a0..."", ""Jan 11, 1989 ... Well, maybe I can do a little of that tonight. People ask how I feel about leaving. And the fact is, ``parting is such sweet sorrow.'' The\u00a0..."", ""In those days, the candidate receiving the second-highest vote became the vice president. In a scheme to deny Adams the presidency, Alexander Hamilton\u00a0...""], ""stance"": ""Refute""}, {""question"": ""What are the specific proposals made by the seven presidential candidates currently running?"", ""search_results"": [""Presidential Primary Election: An election at which a political party's voters are given ... Runoff Election: An election held if no candidate for a particular\u00a0..."", ""Find what you need to know about the federal campaign finance process. Explore legal resources, campaign finance data, help for candidates and committees,\u00a0..."", ""10 (2021) are approved and ratified by the voters at the 2024 General Election; and (2) before November 26, 2024, Congress consents to the amendment proposed by\u00a0...""], ""stance"": ""Refute""}]}, ""The airport belongs to President Stevo Pendarovski"": {""Questions"": [{""question"": ""What is the current president of North Macedonia?"", ""search_results"": [""President of North Macedonia ; Incumbent Gordana Siljanovska-Davkova. since 12 May 2024 ; Incumbent Gordana Siljanovska-Davkova. since 12 May 2024 \u00b7 Head of State."", ""May 9, 2024 ... Siljanovska-Davkova is the first female president in the history of North Macedonia, which seceded from the former Yugoslavia following a referendum in 1991."", ""The prime minister of North Macedonia (Macedonian: \u041f\u0440\u0435\u043c\u0438\u0435\u0440 \u043d\u0430 \u0421\u0435\u0432\u0435\u0440\u043d\u0430 \u041c\u0430\u043a\u0435\u0434\u043e\u043d\u0438\u0458\u0430, romanized: Premier na Severna Makedonija, Albanian: Kryeministri i\u00a0...""], ""stance"": ""Refute""}, {""question"": ""Who are the candidates running for the presidential election in North Macedonia?"", ""search_results"": [""Candidates \u00b7 1. Stevo Pendarovski (incumbent), SDSM 28 February 2024 \u00b7 2. Gordana Siljanovska-Davkova \u00b7 VMRO-DPMNE 22 February 2024 \u00b7 3. Stev\u010do Jakimovski \u00b7 GROM\u00a0..."", ""Apr 25, 2024 ... North Macedonia's right-wing candidate Gordana Siljanovska-Davkova claimed a comprehensive victory in the first round of presidential elections on Wednesday."", ""Apr 15, 2024 ... ... vote through a two-round system (see \u201cWhen is Election Day?\u201d). In a second round of presidential elections, the candidate who wins most of\u00a0...""], ""stance"": ""Refute""}, {""question"": ""Is there a specific airport mentioned as belonging to President Stevo Pendarovski?"", ""search_results"": [""Oct 5, 2019 ... Pompeo arrived at the Ohrid airport on Friday afternoon, where ... there the Secretary met with the President Stevo Pendarovski. \u201cUSA\u00a0..."", ""Sep 2, 2021 ... The Ecumenical Patriarch thanked President Stevo Pendarovski for his visit and for the interesting discussion they had. ... Special mention was\u00a0..."", ""as Foreign Policy Advisor to the Macedonian President Stevo Pendarovski (who is also from the SDSM)?!? ... radiation in Antarctica depends on the specific\u00a0...""], ""stance"": ""Completely Supports""}]}, ""The airport is owned by President Stevo Pendarovski"": {""Questions"": [{""question"": ""What is the relationship between President Stevo Pendarovski and the airport?"", ""search_results"": [""May 26, 2021 ... President Stevo Pendarovski welcomed today the President of the Republic of Bulgaria, Rumen Radev, at the Skopje International Airport."", ""Oct 5, 2019 ... Pompeo arrived at the Ohrid airport on Friday afternoon, where he was greeted by ... with the President Stevo Pendarovski. \u201cUSA is our strategic\u00a0..."", ""Jun 16, 2021 ... ... Stevo Pendarovski [R] at Skopje airport on May 26, 2021. Photo ... They are to meet Bulgarian President Rumen Radev, caretaker Prime\u00a0...""], ""stance"": ""Completely Supports""}, {""question"": ""In what way do presidential candidates in North Macedonia offer a range of promises and slogans to attract voters?"", ""search_results"": [""Apr 15, 2019 ... The messages are different, but the two front-runners in the race to become North Macedonia's next president have a shared goal \u2013 to win\u00a0..."", ""Nov 7, 2018 ... ... political parties, populists tend to reach voters in a much more personalistic way. ... are typically responsible for selecting candidates\u00a0..."", ""I think I should indicate why I am here in Birmingham, since you have been influenced by the view which argues against \""outsiders coming in.\"" I have the honor\u00a0...""], ""stance"": ""Refute""}, {""question"": ""What are the concrete proposals offered by the seven aspirants competing for the presidency in North Macedonia?"", ""search_results"": [""Dec 3, 2024 ... The NATO Secretary General and the EU High Representative for Foreign Affairs and Security Policy/Vice President of the European Commission\u00a0..."", ""Oct 8, 2024 ... A LETTER FROM THE PRESIDENTS. Summit County Voters,. In collaboration with the League of Women. Voters' Akron Area Education Fund, the."", ""Dec 19, 2019 ... Regarding Albania, France was backed by Denmark and the Netherlands, but it stood alone with its veto against North Macedonia. President Macron\u00a0...""], ""stance"": ""Refute""}]}}","{""The airport is with President Stevo Pendarovski"": {""What is the relationship between the airport and President Stevo Pendarovski?"": ""Completely Supports"", ""In what ways do the presidential candidates differ in their promises and slogans?"": ""Refute"", ""What are the specific proposals made by the seven presidential candidates currently running?"": ""Refute""}, ""The airport belongs to President Stevo Pendarovski"": {""What is the current president of North Macedonia?"": ""Refute"", ""Who are the candidates running for the presidential election in North Macedonia?"": ""Refute"", ""Is there a specific airport mentioned as belonging to President Stevo Pendarovski?"": ""Completely Supports""}, ""The airport is owned by President Stevo Pendarovski"": {""What is the relationship between President Stevo Pendarovski and the airport?"": ""Completely Supports"", ""In what way do presidential candidates in North Macedonia offer a range of promises and slogans to attract voters?"": ""Refute"", ""What are the concrete proposals offered by the seven aspirants competing for the presidency in North Macedonia?"": ""Refute""}}",Neutral,"{""Completely Supports"": 3, ""Partially Supports"": 0, ""Refute"": 6, ""Irrelevant"": 0, ""No Evidence"": 0, ""Unknown"": 0}"
1146589880118487,"{""We should reduce spending for walking to #\u0412\u043e\u0434\u043d\u043e, together with our citizens and we used the opportunity to discuss what concerns citizens."": {""Questions"": [{""question"": ""What is the purpose of reducing spending for walking to #\u0412\u043e\u0434\u043d\u043e?"", ""search_results"": [""Anxiety and depression are both stress-related mental illnesses [36], meaning that the stress-reducing effects of spending time in natural environments may help\u00a0..."", ""tor spending and associated investments at lo- cal scales. ... These include commitments on reducing CO2 emissions, reducing energy use, monitoring and\u00a0..."", ""Jan 31, 2025 ... Goal 10: Reduced Inequalities. + \u00b7 Goal 11. Goal 11: Sustainable Cities ... Programme of Work and Budget. Resources. Frequently Asked\u00a0...""], ""stance"": ""Refute""}, {""question"": ""What concerns do citizens have, and how did they discuss them with the government?"", ""search_results"": [""Many people say that citizens also have important responsibilities to their country that aliens do not. We will examine what those responsibilities might be in\u00a0..."", ""... you to pay them to fix a problem that does not exist. These scams were responsible for over $1.3 billion in losses in 2023 alone. Learn more: fbi.gov/scams."", ""Nov 5, 2024 ... Bills can also be petitioned by people or citizen groups who recommend a new or amended law to a member of Congress that represents them.""], ""stance"": ""Refute""}, {""question"": ""What are the specific promises or slogans being offered by presidential candidates Biljana Vankovsk\u00ebn, Maksim Dimitrievski, and Stef\u00e7e Jakimovski?"", ""search_results"": [], ""stance"": ""No Evidence""}]}, ""Continuing on the European path is the only alternative for substantial and positive changes in our country."": {""Questions"": [{""question"": ""What specific changes are being proposed by the presidential candidates in North Macedonia?"", ""search_results"": [""May 5, 2019 ... Voters in North Macedonia on Sunday elected a government-backed candidate who plans to bring the country into NATO under its new name over a rival."", ""SKOPJE, 9 May 2024 \u2013 North Macedonia's ... We hope that going forward, North Macedonia will continue to strengthen its democracy, and ODIHR remains ready to provide support for these efforts."", ""Apr 25, 2024 ... North Macedonia's right-wing candidate Gordana Siljanovska-Davkova claimed a comprehensive victory in the first round of presidential elections on Wednesday.""], ""stance"": ""Partially Supports""}, {""question"": ""How do the current candidates differ from each other in terms of their policy offerings?"", ""search_results"": [""In preparation for the 2024 presidential election, Penn Wharton Budget Model (PWBM) has compiled a brief guide to our analyses of the candidates' policy\u00a0..."", ""... each candidate will have to answer tough questions about their policies as well as defend their stance on issues and policies against other candidates."", ""A: Scholars will experience the same program at all three campuses. There may be minor differences in the course offerings, but overall, the program is the same\u00a0...""], ""stance"": ""Refute""}, {""question"": ""What concrete actions are being promised by the presidential candidates in North Macedonia to bring about positive change?"", ""search_results"": [""Sep 22, 2024 ... ... action can a lasting difference be made. Israel believes that ... GORDANA SILJANOVSKA-DAVKOVA, President of the Republic of North Macedonia\u00a0..."", ""... promises of change. ... Kenya's Supreme Court initially won broad praise for annulling the results of what it deemed to be a flawed presidential election."", ""May 4, 2023 ... Today, the EU can easily take in Albania, Kosovo, and North Macedonia. ... change within the EU before Ukraine and other candidate countries can\u00a0...""], ""stance"": ""Partially Supports""}]}, ""We will not give up on European integration and building a better society for citizens."": {""Questions"": [{""question"": ""What does the claim 'We will not give up on European integration and building a better society for citizens' have to do with the Macedonian presidential election?"", ""search_results"": [""how we could be wrong; and we do not advocate policy ... In this more contested world, communities are increasingly fractured as people seek security with."", ""I am here because I have organizational ties here. But more basically, I am in Birmingham because injustice is here."", ""Nov 14, 2024 ... In addition, while the enlargement process has returned to the EU agenda with Russia's aggression against Ukraine, it did not actually make the\u00a0...""], ""stance"": ""Partially Supports""}, {""question"": ""What is the main focus of the candidates in the Macedonian presidential election?"", ""search_results"": [""Apr 15, 2019 ... Out-of-country voting will occur on April 20. Three candidates have received the necessary 10,000 signatures to stand for nomination for the\u00a0..."", ""Apr 25, 2024 ... Gordana Siljanovska-Davkova, the presidential candidate supported by North Macedonia's main ... election in 2019, led a crowded field of\u00a0..."", ""Presidential elections were held in North Macedonia on 24 April 2024. Incumbent Stevo Pendarovski of the ruling centre-left Social Democrats ran for\u00a0...""], ""stance"": ""Irrelevant""}, {""question"": ""Who are the seven aspirants running for the position of President of North Macedonia, as mentioned in the article?"", ""search_results"": [""Oct 3, 2024 ... Countries aspiring to join NATO have to demonstrate that they are in a position ... North Macedonia in March 2020. Allied Leaders also agreed at\u00a0..."", ""Apr 24, 2024 ... Which candidates are running? Incumbent Stevo Pendarovski of the Social Democratic Union of Macedonia (SDSM) is looking to retain his position."", ""Apr 22, 2024 ... Seven candidates are vying for the largely ceremonial position in Wednesday's vote. With more than 50% of the country's 1.8 million\u00a0...""], ""stance"": ""Partially Supports""}]}}","{""We should reduce spending for walking to #\u0412\u043e\u0434\u043d\u043e, together with our citizens and we used the opportunity to discuss what concerns citizens."": {""What is the purpose of reducing spending for walking to #\u0412\u043e\u0434\u043d\u043e?"": ""Refute"", ""What concerns do citizens have, and how did they discuss them with the government?"": ""Refute"", ""What are the specific promises or slogans being offered by presidential candidates Biljana Vankovsk\u00ebn, Maksim Dimitrievski, and Stef\u00e7e Jakimovski?"": ""No Evidence""}, ""Continuing on the European path is the only alternative for substantial and positive changes in our country."": {""What specific changes are being proposed by the presidential candidates in North Macedonia?"": ""Partially Supports"", ""How do the current candidates differ from each other in terms of their policy offerings?"": ""Refute"", ""What concrete actions are being promised by the presidential candidates in North Macedonia to bring about positive change?"": ""Partially Supports""}, ""We will not give up on European integration and building a better society for citizens."": {""What does the claim 'We will not give up on European integration and building a better society for citizens' have to do with the Macedonian presidential election?"": ""Partially Supports"", ""What is the main focus of the candidates in the Macedonian presidential election?"": ""Irrelevant"", ""Who are the seven aspirants running for the position of President of North Macedonia, as mentioned in the article?"": ""Partially Supports""}}",Not Spreading Misinformation,"{""Completely Supports"": 0, ""Partially Supports"": 4, ""Refute"": 3, ""Irrelevant"": 1, ""No Evidence"": 1, ""Unknown"": 0}"
