ad_archive_id,claims_to_questions,stance_results,verdict,stance_counts
2103884769993693,"{""Together we are united for our common goal, European future of our country"": {""Questions"": [{""question"": ""Is the claim that the candidates in the North Macedonian presidential election have started offering a wide range of promises and slogans to attract voters true?"", ""search_results"": [""Jan 31, 2024 ... The claim that the 2020 presidential election was stolen is provably false, was put forward with demonstrated bad faith, and has deeply\u00a0..."", ""Nov 7, 2018 ... The report identifies 46 populist leaders or political parties that have held executive office across 33 countries between 1990 and today."", ""Democracy faced its most serious crisis in decades in 2017 as its basic tenets\u2014including guarantees of free and fair elections, the rights of minorities,\u00a0...""], ""stance"": ""Refute""}, {""question"": ""Are the four candidates mentioned (Biljana Vankovska, Maksim Dimitrievski, Stef\u00e7e Jakimovski) actual contestants in the 2023 North Macedonian presidential election?"", ""search_results"": [], ""stance"": ""No Evidence""}, {""question"": ""Do the candidates' main goals align with the claim's statement about a 'common goal, European future' for the country?"", ""search_results"": [""Discover the aims of the EU and the values on which it is founded: promoting peace and security, and respecting fundamental rights and freedoms."", ""... doing so in a coordinated way that aligns all policies behind the common goal. ... Europe's major competitors, as single countries, can apply these strategies."", ""and PhDs in AI and creating common European data spaces. Objective 2.6 of the ... This is a key objective in the EU plan (objective. 2.4: 'adapting our\u00a0...""], ""stance"": ""Partially Supports""}]}, ""There is no giving up on the future!"": {""Questions"": [{""question"": ""Is the statement 'There is no giving up on the future!' true?"", ""search_results"": [""Jun 15, 2017 ... A person that really loves you wouldn't give up on you no matter how hard the situation is \u2014 when it's real you can't walk away. Love\u00a0..."", ""\u201cIf I were an Arab leader, I would never sign an agreement with Israel. It is normal; we have taken their country. It is true God promised it to us, but how\u00a0..."", ""Lamentably, it is an historical fact that privileged groups seldom give up their privileges voluntarily. ... Like a boil that can never be cured so long as it is\u00a0...""], ""stance"": ""Refute""}, {""question"": ""What attributes should the next President of North Macedonia possess, according to the article?"", ""search_results"": [""Mar 16, 2019 ... Appeal (Article 74). 33. Pursuant to Article 74, the judge/court president against whom disciplinary proceedings were initiated have a right\u00a0..."", ""Readers of the report will recog- nize some of the ongoing challenges democracies face but also observe new cases where agents have reclaimed democracy and."", ""Feb 12, 2019 ... The parties have agreed, among other things, to the name \""Republic of North Macedonia\"" in Article 1, paragraph 3, of the Final Agreement. I\u00a0...""], ""stance"": ""Irrelevant""}, {""question"": ""Do the presidential candidates in North Macedonia's election offer specific promises and slogans?"", ""search_results"": [""Our objective is to promote and advance sustainable democracy and to improve and consolidate electoral processes world-wide."", ""May 7, 2024 ... On May 8, North Macedonia will vote in parliamentary and presidential elections that will determine whether the country keeps its pro-EU course."", ""Apr 24, 2024 ... The vote for the largely ceremonial presidency is widely seen as a litmus test for a parliamentary election next month in which VMRO-DPMNE is\u00a0...""], ""stance"": ""Partially Supports""}]}, ""All together with SDSM, Coalition for European Identity and our President Stevo Pendarovski to show that we are all united in our common goal"": {""Questions"": [{""question"": ""What is the political party that the speaker is referring to when they mention 'SDSM'?"", ""search_results"": [""Aug 22, 2024 ... \""To every American of every political party, and those of none: I say now is not the time to watch quietly as Donald Trump threatens the\u00a0..."", ""Aug 22, 2024 ... \""To every American of every political party, and those of none: I say now is not the time to watch quietly as Donald Trump threatens the\u00a0..."", ""5 days ago ... I'm curious if you could advise a Democratic Party about a candidate for twenty twenty eight, what would you say? Speaker 2 (53:28): It's a\u00a0...""], ""stance"": ""Refute""}, {""question"": ""In what year did the election campaign for the President of North Macedonia start?"", ""search_results"": [""May 9, 2024 ... North Macedonia's presidential run-off and parliamentary elections were competitive and an extensive and pluralistic campaign helped voters to make an informed\u00a0..."", ""Apr 15, 2024 ... For more information and details, please find the full FAQs in PDF format. Frequently Asked Questions (FAQs). When is Election Day?"", ""Apr 5, 2024 ... Polls show incumbent President Stevo Pendarovski, who is seeking a second five-year term with support from the governing social democrats, in\u00a0...""], ""stance"": ""Partially Supports""}, {""question"": ""What are some examples of promises and slogans made by presidential candidates in this election?"", ""search_results"": [""Promises Made, Promises Kept. Withdrawn candidates. The following chart includes the campaign logo and slogan for withdrawn 2020 presidential candidates."", ""This would have made Adams's running mate, Thomas Pinckney, President, with Adams as vice president. But New England Federalists, learning of the scheme,\u00a0..."", ""Mar 2, 2022 ... John F. Kennedy was elected president in one of the closest elections in United States history. Kennedy's popular vote margin over Nixon was\u00a0...""], ""stance"": ""Refute""}]}}","{""Together we are united for our common goal, European future of our country"": {""Is the claim that the candidates in the North Macedonian presidential election have started offering a wide range of promises and slogans to attract voters true?"": ""Refute"", ""Are the four candidates mentioned (Biljana Vankovska, Maksim Dimitrievski, Stef\u00e7e Jakimovski) actual contestants in the 2023 North Macedonian presidential election?"": ""No Evidence"", ""Do the candidates' main goals align with the claim's statement about a 'common goal, European future' for the country?"": ""Partially Supports""}, ""There is no giving up on the future!"": {""Is the statement 'There is no giving up on the future!' true?"": ""Refute"", ""What attributes should the next President of North Macedonia possess, according to the article?"": ""Irrelevant"", ""Do the presidential candidates in North Macedonia's election offer specific promises and slogans?"": ""Partially Supports""}, ""All together with SDSM, Coalition for European Identity and our President Stevo Pendarovski to show that we are all united in our common goal"": {""What is the political party that the speaker is referring to when they mention 'SDSM'?"": ""Refute"", ""In what year did the election campaign for the President of North Macedonia start?"": ""Partially Supports"", ""What are some examples of promises and slogans made by presidential candidates in this election?"": ""Refute""}}",Spreading Misinformation,"{""Completely Supports"": 0, ""Partially Supports"": 3, ""Refute"": 4, ""Irrelevant"": 1, ""No Evidence"": 1, ""Unknown"": 0}"
1747310152446379,"{""Police station reports are always an inspiration for many questions from all council groups, without exception."": {""Questions"": [{""question"": ""What is the statement claiming about police station reports?"", ""search_results"": [""File a police report online after you submit your report. When your online report is complete, you will see this message: \u201cYour online police report has been\u00a0..."", ""3 days ago ... FALSE REPORTS FOR INSURANCE CLAIMS: If the police report is made or required for filing an insurance claim, knowingly providing false\u00a0..."", ""All other incident reports may be requested using the form below or by emailing a completed form to ccu@baltimorepolice.org. BPD will attempt to produce\u00a0...""], ""stance"": ""Partially Supports""}, {""question"": ""What are the candidates promising in their campaigns for the North Macedonian presidential election?"", ""search_results"": [""Apr 27, 2014 ... Unity and its presidential candidate dominated both campaigns. In addition, the campaign of the governing party often did not adequately\u00a0..."", ""May 7, 2024 ... On May 8, North Macedonia will vote in parliamentary and presidential elections that will determine whether the country keeps its pro-EU course."", ""Apr 25, 2024 ... North Macedonia's right-wing candidate Gordana Siljanovska-Davkova claimed a comprehensive victory in the first round of presidential elections on Wednesday.""], ""stance"": ""No Evidence""}, {""question"": ""What does the article mention as the concerns of the electoral arena?"", ""search_results"": [""... arena. But the rules of politics vary a lot from ... These different electoral systems can drive politics toward more national or more local concerns."", ""Dec 5, 2023 ... In our view, promoting a more informed electorate and safeguarding the integrity of the electoral process are the most compelling objectives for\u00a0..."", ""Oct 4, 2021 ... ... electoral arena (political parties) are concerned. We however see a ... While our article has been concerned with far-right protest\u00a0...""], ""stance"": ""Refute""}]}, ""The reason the annual report is 5 pages shorter than the 6-monthly one is because some sensitive data was moved to other sections."": {""Questions"": [{""question"": ""What is the reason for the difference in length between the annual report and the 6-monthly one?"", ""search_results"": [""5 days ago ... Infants up to 12 months, especially those 6 months and younger are at higher risk of RSV. ... Differences in length of life, quality of life,\u00a0..."", ""I understand and agree to give copies of all documents needed to complete my semi-annual report. ... One time payment or monthly. How much. Name. CERTIFICATION -\u00a0..."", ""As part of this six-month reporting, STEM OPT students must confirm that ... In cases where the period of time between employers is longer than 10 days\u00a0...""], ""stance"": ""Irrelevant""}, {""question"": ""How do the presidential candidates' promises and slogans align with their political ideologies?"", ""search_results"": [""In a scheme to deny Adams the presidency, Alexander Hamilton influenced South Carolina's Federalist electors to withhold their votes from Adams. This would have\u00a0..."", ""Mar 2, 2022 ... John F. Kennedy was elected president in one of the closest elections in United States history. Kennedy's popular vote margin over Nixon was\u00a0..."", ""He began his political activism opposing the War in Iraq under George Bush, aligning ... All voters have the right to vote for the candidate of their choosing\u00a0...""], ""stance"": ""Irrelevant""}, {""question"": ""What specific policies or initiatives are offered by the presidential candidates Biljana Vankovska, Maksim Dimitrievski, and Stef\u00e7e Jakimovski?"", ""search_results"": [], ""stance"": ""No Evidence""}]}, ""There were only 2 fines issued for noise music complaints in 2023."": {""Questions"": [{""question"": ""What is the source of the information about only 2 fines issued for noise music complaints in 2023?"", ""search_results"": [""Sounds of the City. Sound levels vary depending on one's distance from the noise source. Below are some frequently heard sounds and their approximate decibel\u00a0..."", ""Complete the Two-Party Noise Complaint Form for noise complaints that are not witnessed by an enforcement officer. The law has a unique provision allowing\u00a0..."", ""Hearing Loss in Construction. Noise and hearing conservation is addressed in specific standards for Construction. Provides information related to noise in\u00a0...""], ""stance"": ""Irrelevant""}, {""question"": ""Is there any correlation between the number of fines and the type of music played (noise music) in the specified year?"", ""search_results"": [""Sep 27, 2009 ... The mandate, proposed by the European Commission with 27 Member States, covers all personal music players and mobile phones with a music playing\u00a0..."", ""... to a civil penalty, as specified in the Department's penalty schedule. ... No person shall play or operate any musical instrument or drum or cause any noise\u00a0..."", ""The Department of Environmental Protection (DEP) and the Police Department (NYPD) share the duties of enforcing the Noise Code. To submit a noise complaint,\u00a0...""], ""stance"": ""Refute""}, {""question"": ""Do any specific regulations or laws govern noise levels in public spaces, and if so, what are they?"", ""search_results"": [""One challenge of measuring sound in the city is that there is a high level of ambient sound, or background noise in an area. For example,. Times Square has high\u00a0..."", ""Jul 31, 2024 ... Laws & Regulations \u00b7 By Business Sector \u00b7 By Topic \u00b7 Compliance ... Did you visit www.epa.gov to accomplish a specific task? If yes\u00a0..."", ""Jun 24, 2024 ... If a public entity chooses to do so, it might mitigate ... They asserted that if a facility has separate areas for specific programs\u00a0...""], ""stance"": ""No Evidence""}]}}","{""Police station reports are always an inspiration for many questions from all council groups, without exception."": {""What is the statement claiming about police station reports?"": ""Partially Supports"", ""What are the candidates promising in their campaigns for the North Macedonian presidential election?"": ""No Evidence"", ""What does the article mention as the concerns of the electoral arena?"": ""Refute""}, ""The reason the annual report is 5 pages shorter than the 6-monthly one is because some sensitive data was moved to other sections."": {""What is the reason for the difference in length between the annual report and the 6-monthly one?"": ""Irrelevant"", ""How do the presidential candidates' promises and slogans align with their political ideologies?"": ""Irrelevant"", ""What specific policies or initiatives are offered by the presidential candidates Biljana Vankovska, Maksim Dimitrievski, and Stef\u00e7e Jakimovski?"": ""No Evidence""}, ""There were only 2 fines issued for noise music complaints in 2023."": {""What is the source of the information about only 2 fines issued for noise music complaints in 2023?"": ""Irrelevant"", ""Is there any correlation between the number of fines and the type of music played (noise music) in the specified year?"": ""Refute"", ""Do any specific regulations or laws govern noise levels in public spaces, and if so, what are they?"": ""No Evidence""}}",Spreading Misinformation,"{""Completely Supports"": 0, ""Partially Supports"": 1, ""Refute"": 2, ""Irrelevant"": 3, ""No Evidence"": 3, ""Unknown"": 0}"
959186065585942,"{""Gratitude to Olaf Scholz for great support towards SDSM, Dimitar Kovachevski and our president Stevo Pendarovski"": {""Questions"": [{""question"": ""What is the relationship between Olaf Scholz and SDSM?"", ""search_results"": [""Sep 10, 2024 ... ... Adam Bodnar will now travel in his place. Chancellor Olaf Scholz, due to deliver a laudation in Tusk's honour, will also not attend the ceremony\u00a0..."", ""Oct 23, 2024 ... ... Olaf Scholz met with ... The relationship between Germany and Turkey remains strained due to Turkey's domestic and foreign policies."", ""Apr 13, 2024 ... ... relationship between the EU and China. In Brussels, fears are growing that China could try to export its way out of its economic malaise by\u00a0...""], ""stance"": ""Refute""}, {""question"": ""Who are the seven presidential candidates in the Macedonian elections, and what do they offer?"", ""search_results"": [""Apr 15, 2024 ... Seven presidential candidates have received either the necessary ... They will also vote one day prior to election day. Each sex should\u00a0..."", ""Apr 27, 2014 ... announced that it would continue its boycott in the second round of the presidential election and ... Macedonian areas where voters were."", ""Apr 24, 2024 ... Seven candidates will compete for the presidential position ... Notably, Bujar Osmani proposes that the president of the country should be elected\u00a0...""], ""stance"": ""No Evidence""}, {""question"": ""What are the key promises or slogans being offered by presidential candidates Biljana Vankovska, Maksim Dimitrievski, and Stef\u00e7e Jakimovski?"", ""search_results"": [], ""stance"": ""No Evidence""}]}, ""Voting for SDSM and the Coalition for European Perspective means voting for a victory of European Macedonia"": {""Questions"": [{""question"": ""What is the exact meaning of 'victory of European Macedonia' in the claim?"", ""search_results"": [""Sep 30, 2018 ... In a public address after the polls closed, Zaev declared the vote a win for \u201cEuropean Macedonia\u201d, insisting that the overwhelming 'yes' vote\u00a0..."", ""Sep 30, 2018 ... The referendum posed the question of whether to rename the country to North Macedonia in an effort by the government to end a bitter, three-\u00a0..."", ""Nov 4, 2024 ... ... EU and Moscow after a campaign marred by claims of Russian meddling ... victory of pro-European candidate Sandu. \u201cThrough the new mandate\u00a0...""], ""stance"": ""Partially Supports""}, {""question"": ""Are the candidates offering a range of promises and slogans to attract voters, as mentioned in the passage?"", ""search_results"": [""Offering multi-disciplinary insight into some of these, this article brings together 43 contributions from experts in fields such as computer science, marketing\u00a0..."", ""... election, is found at. ORC 3315.07 (C)(2): A board of ... the role of merely providing factual information and into advocacy for passage of the levy or."", ""Shown Here: Public Law No: 117-328 (12/23/2022). Consolidated Appropriations Act, 2023. This act provides appropriations to federal agencies for the\u00a0...""], ""stance"": ""Refute""}, {""question"": ""Who are the 7 presidential aspirants competing for the post of President of North Macedonia, according to the passage?"", ""search_results"": [""Global Trends is designed to provide an analytic framework for policymakers early in each administration as they craft national security strategy and\u00a0..."", ""President Trump himself has mingled the concerns of his business empire with his role as president, appointed family members to his senior staff, filled other\u00a0..."", ""North Macedonia \u00b7 Norway ... Instead, candidates need a plurality of votes \u2013 that is, a higher percentage of votes than other candidates running for office.""], ""stance"": ""No Evidence""}]}, ""Greatest thanks to Olaf Scholz for his immense support directed towards SDSM, Dimitar Kovachevski and our President Stevo Pendarovski"": {""Questions"": [{""question"": ""How does Olaf Scholz's support relate to SDSM and the Macedonian government?"", ""search_results"": [""Jun 11, 2022 ... German Chancellor Olaf Scholz visited North Macedonia and Bulgaria on Saturday in a bid to resolve the dispute between both countries."", ""Only Bulgaria and Mickoski are dissatisfied with the strong and clear support of Germany and Chancellor Olaf Scholz for the country's European future."", ""Mar 22, 2022 ... Would you help us improve our website. Note: This feature ... spoke today with President Emmanuel Macron of France, Chancellor Olaf Scholz\u00a0...""], ""stance"": ""Completely Supports""}, {""question"": ""What are the key promises made by the presidential candidates in North Macedonia, specifically Biljana Vankovska, Maksim Dimitrievski, and Stef\u00e7e Jakimovski?"", ""search_results"": [], ""stance"": ""No Evidence""}, {""question"": ""Can you confirm or deny that seven aspirants are vying for the presidency of North Macedonia?"", ""search_results"": [""Oct 3, 2024 ... Participation in the MAP does not guarantee membership. Countries aspiring to join NATO have to demonstrate that they are in a position to\u00a0..."", ""3 days ago ... Thank you. MS BRUCE: Well, I would say for questions about what President Trump might do, you must check with the White House. We do know\u00a0..."", ""Licensees with a Type 58 caterer's permit can serve alcohol with an approved authorization from ABC. A non-profit may apply for a daily license to sell beer and\u00a0...""], ""stance"": ""No Evidence""}]}}","{""Gratitude to Olaf Scholz for great support towards SDSM, Dimitar Kovachevski and our president Stevo Pendarovski"": {""What is the relationship between Olaf Scholz and SDSM?"": ""Refute"", ""Who are the seven presidential candidates in the Macedonian elections, and what do they offer?"": ""No Evidence"", ""What are the key promises or slogans being offered by presidential candidates Biljana Vankovska, Maksim Dimitrievski, and Stef\u00e7e Jakimovski?"": ""No Evidence""}, ""Voting for SDSM and the Coalition for European Perspective means voting for a victory of European Macedonia"": {""What is the exact meaning of 'victory of European Macedonia' in the claim?"": ""Partially Supports"", ""Are the candidates offering a range of promises and slogans to attract voters, as mentioned in the passage?"": ""Refute"", ""Who are the 7 presidential aspirants competing for the post of President of North Macedonia, according to the passage?"": ""No Evidence""}, ""Greatest thanks to Olaf Scholz for his immense support directed towards SDSM, Dimitar Kovachevski and our President Stevo Pendarovski"": {""How does Olaf Scholz's support relate to SDSM and the Macedonian government?"": ""Completely Supports"", ""What are the key promises made by the presidential candidates in North Macedonia, specifically Biljana Vankovska, Maksim Dimitrievski, and Stef\u00e7e Jakimovski?"": ""No Evidence"", ""Can you confirm or deny that seven aspirants are vying for the presidency of North Macedonia?"": ""No Evidence""}}",Not Spreading Misinformation,"{""Completely Supports"": 1, ""Partially Supports"": 1, ""Refute"": 2, ""Irrelevant"": 0, ""No Evidence"": 5, ""Unknown"": 0}"
