ad_archive_id,claims_to_questions,stance_results,verdict,stance_counts
1501205007127687,"{""Macedonian people will win the platform"": {""Questions"": [{""question"": ""What is the current situation with the presidential election in North Macedonia?"", ""search_results"": [""Apr 15, 2019 ... Three candidates have received the necessary 10,000 signatures to stand for nomination for the position of president of the Republic of North\u00a0..."", ""Presidential elections were held in North Macedonia on 24 April 2024. Incumbent Stevo Pendarovski of the ruling centre-left Social Democrats ran for\u00a0..."", ""Apr 15, 2024 ... On Wednesday, April 24, North Macedonia will hold presidential elections. Elections take place among political tensions within the country,\u00a0...""], ""stance"": ""Partially Supports""}, {""question"": ""Who are the main candidates running for president, and what promises have they made?"", ""search_results"": [""Aug 7, 2024 ... We analyzed three rally speeches following President Joe Biden's withdrawal from the 2024 race. He made nearly the same promises at each one,\u00a0..."", ""Sep 30, 2024 ... In the current presidential campaign, for instance, Donald Trump pledged to make IVF treatments free for all couples, an improbable policy that\u00a0..."", ""Oct 15, 2020 ... It's been four years since Donald Trump made a string of promises during his long 2016 campaign to be the 45th president of the United States.""], ""stance"": ""Refute""}, {""question"": ""Do the candidates' slogans and promises actually address the key issues facing North Macedonian people?"", ""search_results"": [""Sep 22, 2024 ... In that regard, the Summit of the Future is an important platform to rethink global partnerships focused on addressing various challenges, such\u00a0..."", ""Democratic governments allow people to help set the rules to which all ... In Macedonia, mediation by Washington and Brussels helped resolve a years\u00a0..."", ""May 15, 2024 ... In the parliamentary election it received almost twice as many votes as the Social Democratic Union of Macedonia (SDSM) which until recently\u00a0...""], ""stance"": ""Partially Supports""}]}, ""The government should prioritize red lines in defense of the Macedonian state"": {""Questions"": [{""question"": ""What is the current political situation in North Macedonia that necessitates prioritizing 'red lines' in defense of the state?"", ""search_results"": [""Oct 30, 2024 ... sources, including contributions from the government of North Macedonia, EU Member States, European ... analyses of the actual situation of SMEs\u00a0..."", ""Dec 2, 2021 ... In the interest of peace and stability in the South China Sea, Manila should both double down on its efforts to advance Code of Conduct\u00a0..."", ""Published every four years since 1997, Global Trends assesses the key trends and uncertainties that will shape the strategic environment for the. United States\u00a0...""], ""stance"": ""Irrelevant""}, {""question"": ""What are the key promises and slogans being offered by presidential candidates to attract voters?"", ""search_results"": [""Although John Quincy Adams should have been the heir apparent to the presidency ... Presidency section), gave him national standing above all other candidates."", ""... Logos and slogans \u2022 Key staffers \u2022 Vice presidential candidates \u2022 Policy positions \u2022 Ballotpedia's presidential election coverage index. Primaries. Democratic\u00a0..."", ""Many leaders of the Democratic Party saw in Roosevelt an attractive mixture of experience (as governor of New York and as a former vice presidential candidate)\u00a0...""], ""stance"": ""Refute""}, {""question"": ""What specific qualities or attributes do the seven presidential aspirants bring to the table, including Biljana Vankovska, Maksim Dimitrievski, and Stef\u00e7e Jakimovski?"", ""search_results"": [], ""stance"": ""No Evidence""}]}, ""The regime of SDS and DUI has been dictatorial and needs to be ended"": {""Questions"": [{""question"": ""What is the definition of a 'dictatorial' regime in the context of SDS and DUI?"", ""search_results"": [""Nov 9, 2010 ... institutional framework and social context, completely another. ... citizenship regime is based on a given country's legislation defining the."", ""Dec 1, 2024 ... immediate context; O'Laughlin & Malle, 2002). Ultimately, whether ... SDs in the range of 0.78-1.06. As with Campbell and Vollhardt's\u00a0..."", ""... meaning more E.A. regimes engage in rivalries than any other regime type (Owen, 2010; Levitsky and Way, 2002). Framed within the context of E.A. regime\u00a0...""], ""stance"": ""Irrelevant""}, {""question"": ""How do the presidential candidates' promises and slogans differ from each other, and what are their main campaign issues?"", ""search_results"": [""Mar 2, 2022 ... John F. Kennedy was elected president in one of the closest elections in United States history. Kennedy's popular vote margin over Nixon was\u00a0..."", ""In those days, the candidate receiving the second-highest vote became the vice president. In a scheme to deny Adams the presidency, Alexander Hamilton\u00a0..."", ""As Clinton won the primaries that carried him to the Democratic nomination for president, his staff devised a slogan that expressed the central issue of his\u00a0...""], ""stance"": ""Irrelevant""}, {""question"": ""Are there any notable differences between the seven aspirants running for President of North Macedonia, beyond their age and party affiliations?"", ""search_results"": [""One significant difference between the two political systems in Denmark and the U.S. is that ... candidates are nominated to represent their parties in the race\u00a0..."", ""... in an agreement between the warring parties signed in August 2001. ... Public surveys also reveal differences in geopolitical affiliations between ethnic groups."", ""The State Board of Elections provides all eligible citizens of the State convenient access to voter registration; provides all registered voters accessible\u00a0...""], ""stance"": ""Refute""}]}}","{""Macedonian people will win the platform"": {""What is the current situation with the presidential election in North Macedonia?"": ""Partially Supports"", ""Who are the main candidates running for president, and what promises have they made?"": ""Refute"", ""Do the candidates' slogans and promises actually address the key issues facing North Macedonian people?"": ""Partially Supports""}, ""The government should prioritize red lines in defense of the Macedonian state"": {""What is the current political situation in North Macedonia that necessitates prioritizing 'red lines' in defense of the state?"": ""Irrelevant"", ""What are the key promises and slogans being offered by presidential candidates to attract voters?"": ""Refute"", ""What specific qualities or attributes do the seven presidential aspirants bring to the table, including Biljana Vankovska, Maksim Dimitrievski, and Stef\u00e7e Jakimovski?"": ""No Evidence""}, ""The regime of SDS and DUI has been dictatorial and needs to be ended"": {""What is the definition of a 'dictatorial' regime in the context of SDS and DUI?"": ""Irrelevant"", ""How do the presidential candidates' promises and slogans differ from each other, and what are their main campaign issues?"": ""Irrelevant"", ""Are there any notable differences between the seven aspirants running for President of North Macedonia, beyond their age and party affiliations?"": ""Refute""}}",Spreading Misinformation,"{""Completely Supports"": 0, ""Partially Supports"": 2, ""Refute"": 3, ""Irrelevant"": 3, ""No Evidence"": 1, ""Unknown"": 0}"
1867634487041320,"{""A lot of damage can be prevented by stopping the small evil."": {""Questions"": [{""question"": ""What is the relationship between 'stopping small evil' and damage prevention?"", ""search_results"": [""Nov 3, 2022 ... The reason you want to stop the evil biome is because it will make your houses invalid. NPCs living in the corruption will get kicked out of their house."", ""Nov 15, 2011 ... December 20, 2011 \u2013 After a heart attack, the portions of the heart damaged by a lack of oxygen become scar tissue."", ""Dec 12, 2020 ... ... protection from evil and good and potentially block several hits which adds up to even more effective health for the sane spell slot. Plus\u00a0...""], ""stance"": ""Partially Supports""}, {""question"": ""How do the presidential candidates in North Macedonia plan to achieve their goals?"", ""search_results"": [""Oct 30, 2024 ... North Macedonia has consistently stated its political commitment to the strategic goal of EU ... plan (MASP) modules, and ensure their upgrade;."", ""Dec 19, 2024 ... direct presidential elections held worldwide. These women leaders represent Iceland, Mexico, Namibia, North Macedonia ... are in political\u00a0..."", ""Oct 3, 2024 ... They are also expected to meet certain political ... 15 February 2019: The Republic of North Macedonia is officially recognised by its\u00a0...""], ""stance"": ""Irrelevant""}, {""question"": ""What are the key promises and slogans offered by the seven aspirants competing for the presidency?"", ""search_results"": [""In those days, the candidate receiving the second-highest vote became the vice president. In a scheme to deny Adams the presidency, Alexander Hamilton\u00a0..."", ""Jul 8, 2024 ... America First: A Return to Common Sense. Our Nation's History is filled with the stories of brave men and women who gave everything they had to\u00a0..."", ""The Campaign and Election of 1928: When the Republican convention in Kansas City began in the summer of 1928, the fifty-three-year-old Herbert Hoover was on the\u00a0...""], ""stance"": ""Irrelevant""}]}, ""Youthful and inexperienced individuals should not be allowed to represent the people."": {""Questions"": [{""question"": ""How is 'youthful and inexperienced' defined in the context of political representation?"", ""search_results"": [""Jul 15, 2024 ... capabilities in education, health and political participation ... Youth: \u201cYouth\u201d lacks a universal age definition, with ranges from age 10\u00a0..."", ""Jan 15, 2021 ... Abercrombie & Fitch Stores, Inc., the Supreme Court stated that there are only two causes of action under Title VII: \u201cdisparate treatment\u201d (or \u201c\u00a0..."", ""In 2022, the jobs gap rate for women was 15 per cent compared with 10.5 per cent for men, meaning an additional 153 million women have unmet need for employment\u00a0...""], ""stance"": ""Partially Supports""}, {""question"": ""What specific characteristics or qualifications should a president have, according to the author?"", ""search_results"": [""Sep 10, 2024 ... Friday, February 8, 1788. Author: Alexander Hamilton or James Madison. To the People of the State of New York: TO WHAT expedient, then, shall we\u00a0..."", ""To register a work with the U.S. Copyright Office, all applicants \u2014 both foreign and domestic \u2014 must satisfy the requirements of U.S. copyright law. In\u00a0..."", ""Sep 10, 2024 ... ... character marked out for that of the President of the United States. ... President should have only a casting vote. And to take the senator\u00a0...""], ""stance"": ""Partially Supports""}, {""question"": ""What are some common campaign promises and slogans that candidates often make during presidential elections?"", ""search_results"": [""The Great Depression that struck during the \""Great Engineer's\"" presidency, and his inability to do much about it, had changed the national mood and its\u00a0..."", ""Mar 2, 2022 ... John F. Kennedy was elected president in one of the closest elections in United States history. Kennedy's popular vote margin over Nixon was\u00a0..."", ""During the convention, the delegates cheered a new campaign slogan, \u201cHe Kept ... candidate, and the Democrats had won only three presidential elections since 1860\u00a0...""], ""stance"": ""Unknown""}]}, ""The state needs to intervene in agriculture to ensure a stable food supply."": {""Questions"": [{""question"": ""How does the claim that 'the state needs to intervene in agriculture to ensure a stable food supply' relate to the topic of presidential elections in North Macedonia?"", ""search_results"": [""Sep 26, 2024 ... ... supplies, leading to food shortages which have compelled the Government to declare a state of emergency in food security. Nonetheless, his\u00a0..."", ""This policy tracker summarizes the key economic responses governments are taking to limit the human and economic impact of the COVID-19 pandemic."", ""Global. Trends reflects the National Intelligence Council's perspective on these future trends; it does not represent the official, coordinated view of the US\u00a0...""], ""stance"": ""Partially Supports""}, {""question"": ""What evidence supports or contradicts the claim that state intervention is necessary for a stable food supply, and what are some potential consequences of this approach?"", ""search_results"": [""mental health needs of young children through part c early intervention: Results from a 50-state survey. ... and (2) provide intervention and supports when need\u00a0..."", ""Indeed, some interventions that successfully reduced diversion of prescription opioids might, at least in theory, initially increase rather than decrease the\u00a0..."", ""This review aims to identify which are the different types of interventions conducted as well as their effectiveness in reducing consumer food waste.""], ""stance"": ""Refute""}, {""question"": ""In what ways might the claim about state intervention in agriculture impact agricultural policy or the overall economy of North Macedonia?"", ""search_results"": [""Aug 26, 2024 ... More than half of total government support to the food and agriculture sector goes to agricultural producer subsidies, and only a quarter is\u00a0..."", ""We offer this analysis with humility, knowing that invariably the future will unfold in ways that we have not foreseen. Although Global Trends is necessarily\u00a0..."", ""A recent World Bank blog highlights how public support to the agriculture ... impacts on households and enhance the overall resilience of the agriculture sector.""], ""stance"": ""Partially Supports""}]}}","{""A lot of damage can be prevented by stopping the small evil."": {""What is the relationship between 'stopping small evil' and damage prevention?"": ""Partially Supports"", ""How do the presidential candidates in North Macedonia plan to achieve their goals?"": ""Irrelevant"", ""What are the key promises and slogans offered by the seven aspirants competing for the presidency?"": ""Irrelevant""}, ""Youthful and inexperienced individuals should not be allowed to represent the people."": {""How is 'youthful and inexperienced' defined in the context of political representation?"": ""Partially Supports"", ""What specific characteristics or qualifications should a president have, according to the author?"": ""Partially Supports"", ""What are some common campaign promises and slogans that candidates often make during presidential elections?"": ""Unknown""}, ""The state needs to intervene in agriculture to ensure a stable food supply."": {""How does the claim that 'the state needs to intervene in agriculture to ensure a stable food supply' relate to the topic of presidential elections in North Macedonia?"": ""Partially Supports"", ""What evidence supports or contradicts the claim that state intervention is necessary for a stable food supply, and what are some potential consequences of this approach?"": ""Refute"", ""In what ways might the claim about state intervention in agriculture impact agricultural policy or the overall economy of North Macedonia?"": ""Partially Supports""}}",Not Spreading Misinformation,"{""Completely Supports"": 0, ""Partially Supports"": 5, ""Refute"": 1, ""Irrelevant"": 2, ""No Evidence"": 0, ""Unknown"": 1}"
767405418873659,"{""Macedonia is a long and wide work, started ages ago, left for us to preserve."": {""Questions"": [{""question"": [""What is the historical context behind the phrase 'Macedonia is a long and wide work, started ages ago, left for us to preserve'?""], ""search_results"": [""Several months ago the affiliate here in Birmingham asked us to be on call to engage in a nonviolent direct action program if such were deemed necessary. We\u00a0..."", ""Feb 1, 2022 ... Then, when Rome split, Greek culture and identity became the centerpiece of the Byzantine Empire, which outlasted the Roman Empire by 1000 years\u00a0..."", ""May 12, 2021 ... ... starting in the 1980s, of the large and competent American industrial manufacturers.\u201d ... All of our jobs have left or are in the process of\u00a0...""], ""stance"": ""Refute""}, {""question"": [""What are the primary campaign promises made by Biljana Vankovska, Maksim Dimitrievski, and Stef\u00e7e Jakimovski in their presidential bids?""], ""search_results"": [], ""stance"": ""No Evidence""}, {""question"": [""Can you name the seven presidential candidates who began campaigning on April 4th, including Biljana Vankovska, Maksim Dimitrievski, and Stef\u00e7e Jakimovski?""], ""search_results"": [], ""stance"": ""No Evidence""}]}, ""The ideology of patriotism teaches you from your grandmother!"": {""Questions"": [{""question"": ""What is the ideology of patriotism and how does it relate to grandmothers?"", ""search_results"": [""Oct 7, 2018 ... I deliberately curate my Twitter feed across ideology. I find ... And perhaps the first wave of the patriotism of love will not be\u00a0..."", ""Jul 30, 2024 ... \u201cMany of our grandmothers and great-grandmothers had seven or eight ... ideology\u201d who must be suppressed. Feminists, LGBTQ+ activists\u00a0..."", ""Jan 11, 2021 ... This point is closely related to the previous one. But let me ... Yes, God can and does work miraculously to soften hearts. And I pray\u00a0...""], ""stance"": ""Refute""}, {""question"": ""What are the primary qualifications that a future President of North Macedonia should possess?"", ""search_results"": [""Individuals' socio-emotional skills (SES), and their perceptions of their skill levels, matter for labor market outcomes and other welfare outcomes."", ""Oct 3, 2024 ... ... would have to be able to demonstrate that they have fulfilled certain requirements. ... North Macedonia in March 2020. Allied Leaders also\u00a0..."", ""This is a list of qualifications that potential candidates must possess in order to stand for election as president of a country.""], ""stance"": ""Irrelevant""}, {""question"": ""What specific promises and slogans have the presidential candidates offered in their campaigns?"", ""search_results"": [""Mar 2, 2022 ... John F. Kennedy was elected president in one of the closest elections in United States history. Kennedy's popular vote margin over Nixon was\u00a0..."", ""In a scheme to deny Adams the presidency, Alexander Hamilton influenced South Carolina's Federalist electors to withhold their votes from Adams. This would have\u00a0..."", ""Aug 7, 2024 ... We take a focused look at what the Republican presidential nominee is promising right now on the campaign trail.""], ""stance"": ""Refute""}]}, ""The death of fascism, the freedom of the people! They have not given up yet. The battle is not over! We are tasked with building a more beautiful Macedonia."": {""Questions"": [{""question"": ""What is the current state of fascism?"", ""search_results"": [""Sep 9, 2024 ... ... modern Europe. \u201cThere's a willingness to think ... state, deployed to impose order and consolidate fascist power \u2014 often through violence."", ""Fascists often advocate for the establishment of a totalitarian one-party state, and for a dirigiste economy (a market economy in which the state plays a strong\u00a0..."", ""May 14, 2023 ... US, Ukraine, Russia, China, Turkey, Israel, Saudi Arabia, Iran. Religious run countries with Sharia for instance or the few Christian states are\u00a0...""], ""stance"": ""Partially Supports""}, {""question"": ""Are there still ongoing battles for freedom and human rights?"", ""search_results"": [""Ongoing civil wars and interstate conflict as well as violence ... Freedom in the World is Freedom House's flagship annual report, assessing\u00a0..."", ""This is, in numbers, the most affected region: more than 45 armed conflicts are currently taking place throughout the Middle East and North Africa in the\u00a0..."", ""The ACLU dares to create a more perfect union \u2014 beyond one person, party, or side. Our mission is to realize this promise of the United States Constitution\u00a0...""], ""stance"": ""Partially Supports""}, {""question"": ""What are the key attributes that a future President of North Macedonia should possess?"", ""search_results"": [""As a result, key local services, such as public transportation, have been severely impacted. ... could potentially intensify in the future. This too may fall\u00a0..."", ""Habitat for Humanity is a nonprofit organization that helps people in your community and around the world build or improve a place they can call home."", ""Jun 3, 2022 ... It is often said that the North Atlantic Treaty Organization was founded in response to the threat posed by the Soviet Union.""], ""stance"": ""Irrelevant""}]}}","{""Macedonia is a long and wide work, started ages ago, left for us to preserve."": {""What is the historical context behind the phrase 'Macedonia is a long and wide work, started ages ago, left for us to preserve'?"": ""Refute"", ""What are the primary campaign promises made by Biljana Vankovska, Maksim Dimitrievski, and Stef\u00e7e Jakimovski in their presidential bids?"": ""No Evidence"", ""Can you name the seven presidential candidates who began campaigning on April 4th, including Biljana Vankovska, Maksim Dimitrievski, and Stef\u00e7e Jakimovski?"": ""No Evidence""}, ""The ideology of patriotism teaches you from your grandmother!"": {""What is the ideology of patriotism and how does it relate to grandmothers?"": ""Refute"", ""What are the primary qualifications that a future President of North Macedonia should possess?"": ""Irrelevant"", ""What specific promises and slogans have the presidential candidates offered in their campaigns?"": ""Refute""}, ""The death of fascism, the freedom of the people! They have not given up yet. The battle is not over! We are tasked with building a more beautiful Macedonia."": {""What is the current state of fascism?"": ""Partially Supports"", ""Are there still ongoing battles for freedom and human rights?"": ""Partially Supports"", ""What are the key attributes that a future President of North Macedonia should possess?"": ""Irrelevant""}}",Spreading Misinformation,"{""Completely Supports"": 0, ""Partially Supports"": 2, ""Refute"": 3, ""Irrelevant"": 2, ""No Evidence"": 2, ""Unknown"": 0}"
