ad_archive_id,claims_to_questions,stance_results,verdict,stance_counts
290104560813309,"{""Let's put an end to the theft of people's money! Let's reset the system! With a two-digit number of deputies, we'll be the biggest obstacle to their criminal laws, harmful policies and privatization of public goods. The power of the fight and our shared destiny depends on you!"": {""Questions"": [{""question"": [""Is the claim related to a specific political system?"", ""false""], ""search_results"": [""Claim means a written demand or written assertion by one of ... Government system for certain contracting, grants, and other assistance-related processes."", ""(2) released an opioid-related harm claim in a statewide opioid settlement agreement; and ... specific incentive information provided by the applicant related to\u00a0..."", ""52.233-4 Applicable Law for Breach of Contract Claim. 52.234 ... Government system for certain contracting, grants, and other assistance-related processes.""], ""stance"": ""Irrelevant""}, {""question"": [""Does the text mention a particular country or region?"", ""true""], ""search_results"": [""For example, type a country, state, province, territory, or city name into each cell. ... will convert your text to the Geography data type. You'll know\u00a0..."", ""The assignment of countries or areas to specific groupings is for statistical convenience and does ... They can also refer to the similar grouping of \""developing\u00a0..."", ""Jan 11, 1989 ... So many of you have written the past few weeks to say thanks, but I could say as much to you. ... Well, maybe I can do a little of that tonight.""], ""stance"": ""Refute""}, {""question"": [""Are the two-digit number of deputies mentioned in the context of a election or voting process?"", ""unclear""], ""search_results"": [""and special voting deputies attend at least one training program every two years.22 In practice, many municipal clerks provide at least two hours of training."", ""Also refers to the process of adding up the numbers that are put in the chart or table. Tally List: A document used to record the votes for candidates and\u00a0..."", ""People who voted for them have their votes moved to their second favourite candidate. This process continues until every vacancy is filled. The numbers you\u00a0...""], ""stance"": ""Irrelevant""}]}, ""Unyielding in Parliament"": {""Questions"": [{""question"": ""What is the unyielding requirement for the next President of North Macedonia?"", ""search_results"": [""Next. 1; 2; 3; 4; 5; 6; 7; 8; 9; 10. What is NATO? WHAT IS NATO? NATO is a political and military alliance of countries from Europe and North America. Its\u00a0..."", ""Dec 12, 2022 ... Quote(s). President Ursula von der Leyen. The Ukrainian spirit remains unbroken and unyielding. We must help Ukrainians through the\u00a0..."", ""Nov 26, 2023 ... ... North Macedonia. FULL STORY. Read more about his visits to Bosnia and Herzegovina, Kosovo, Serbia and North Macedonia or watch our recap video \u2193.""], ""stance"": ""Partially Supports""}, {""question"": ""Who are the 7 presidential candidates competing in the election, and what are their promises and slogans?"", ""search_results"": [""The Campaign and Election of 1912. Although Woodrow Wilson was convinced that God had destined him to be president, it took all his political skill and a good\u00a0..."", ""... election in which a candidate for Federal office (President,. Senator, or Representative) appears on the ballot. Page 43. 43. Federal Election Campaign Act (\u00a0..."", ""Many leaders of the Democratic Party saw in Roosevelt an attractive mixture of experience (as governor of New York and as a former vice presidential candidate)\u00a0...""], ""stance"": ""No Evidence""}, {""question"": ""What specific attributes or qualifications do the presidential candidates possess to lead North Macedonia?"", ""search_results"": [""Oct 10, 2024 ... ... candidate has \u201cthe personality and leadership qualities a president should have.\u201d Thus, although Trump separately does better on the \u201cstrong\u00a0..."", ""For Primary and General Elections, any qualified elector of Williams County can ... North Dakota does not have voter registration. To be eligible to vote\u00a0..."", ""Qualifications, Elections, Terms, and Compensation ... from prohibiting certain activities have been held to not be general laws since they do.""], ""stance"": ""Irrelevant""}]}, ""Do not let them rule without Left"": {""Questions"": [{""question"": ""What is the current election status in North Macedonia?"", ""search_results"": [""The right-wing opposition coalition led by the nationalist VMRO-DPMNE party decisively won the election receiving 45% of the vote and 58 seats which were three\u00a0..."", ""The parliamentary elections were held in parallel with the run-off presidential election. Ms. Gordana Siljanovska-Davkova (VMRO-DPMNE) defeated incumbent\u00a0..."", ""Our voter portal allows you to perform most common tasks. Update your registration. View your ballot. Request one. Check its status. View your elected\u00a0...""], ""stance"": ""Partially Supports""}, {""question"": ""Who are the seven presidential candidates competing for office?"", ""search_results"": [""Seven candidates did compete in the election for the presidency of the International Olympic Committee (IOC) at the 144th IOC Session held from 18 to 21\u00a0..."", ""Sep 16, 2024 ... Seven candidates will compete in the election for the presidency of the International Olympic Committee (IOC) at the 143rd IOC Session held\u00a0..."", ""Southwest ISD General \u00b7 Early Vote Period: Tuesday, April 22, 2025 - Tuesday, April 29, 2025. Election Day Vote Period: Saturday, May 3, 2025 (7 AM to 7 PM).""], ""stance"": ""Partially Supports""}, {""question"": ""What specific promises and slogans have been made by the presidential candidates?"", ""search_results"": [""... have these forces been so united against one candidate as they stand today. ... What the 1936 election made most clear was that because of FDR and the New\u00a0..."", ""Aug 7, 2024 ... A pledge to end inflation ranks high on the 2024 Republican Party platform, though inflation has been down. And as for the promise to \u201cmake\u00a0..."", ""Because the Republicans had been the majority party since the 1890s (only Cleveland and Wilson would serve as Democratic presidents in the more than 70-year\u00a0...""], ""stance"": ""Partially Supports""}]}}","{""Let's put an end to the theft of people's money! Let's reset the system! With a two-digit number of deputies, we'll be the biggest obstacle to their criminal laws, harmful policies and privatization of public goods. The power of the fight and our shared destiny depends on you!"": {""Is the claim related to a specific political system?"": ""Irrelevant"", ""Does the text mention a particular country or region?"": ""Refute"", ""Are the two-digit number of deputies mentioned in the context of a election or voting process?"": ""Irrelevant""}, ""Unyielding in Parliament"": {""What is the unyielding requirement for the next President of North Macedonia?"": ""Partially Supports"", ""Who are the 7 presidential candidates competing in the election, and what are their promises and slogans?"": ""No Evidence"", ""What specific attributes or qualifications do the presidential candidates possess to lead North Macedonia?"": ""Irrelevant""}, ""Do not let them rule without Left"": {""What is the current election status in North Macedonia?"": ""Partially Supports"", ""Who are the seven presidential candidates competing for office?"": ""Partially Supports"", ""What specific promises and slogans have been made by the presidential candidates?"": ""Partially Supports""}}",Not Spreading Misinformation,"{""Completely Supports"": 0, ""Partially Supports"": 4, ""Refute"": 1, ""Irrelevant"": 3, ""No Evidence"": 1, ""Unknown"": 0}"
1490529958561891,"{""National unity is more important than ever"": {""Questions"": [{""question"": ""What is the current state of national unity in North Macedonia?"", ""search_results"": [""Nov 14, 2024 ... While the transatlantic community will remain preoccupied with a political transition in the European Union (EU) and elections the United States\u00a0..."", ""... Macedonian National Unity (VMRO-DPMNE), the largest opposition party. The ... Moreover, in August 2022, the European Commission negotiated a status agreement with\u00a0..."", ""May 15, 2024 ... ... state and the lack of quick progress in Macedonia's integration with the EU. ... Macedonian National Unity (VMRO-DPMNE) came first. The\u00a0...""], ""stance"": ""Partially Supports""}, {""question"": ""To what extent do the presidential candidates promise to prioritize national unity during their campaign?"", ""search_results"": [""Aug 19, 2024 ... The stakes in this election are enormously high. President Biden and Vice President Harris took office during a time of global pandemic, record\u00a0..."", ""Jan 17, 2024 ... In Africa's first presidential election of the year on January 14, Comoros President Azali Assoumani is running for a fourth term, abetted by a\u00a0..."", ""It will end in a way, and at an hour, of our choosing.\u201d President Bush Washington, D.C. (The National Cathedral) September 14, 2001. The United States of\u00a0...""], ""stance"": ""Partially Supports""}, {""question"": ""How will the winner of the upcoming presidential election be expected to address the issue of national unity?"", ""search_results"": [""Jan 17, 2024 ... ... set the country on a path to address a host of other strategic issues. ... Ghana's presidential elections will usher in a new leader as President\u00a0..."", ""Feb 8, 2022 ... In his 1941 State of the Union Address to Congress, with World War II underway in Europe and the Pacific, FDR asked the American people to work\u00a0..."", ""Jan 20, 2025 ... I return to the presidency confident and optimistic that we are at the start of a thrilling new era of national success.""], ""stance"": ""Irrelevant""}]}, ""It's necessary to ensure national unity by ceasing attacks on parties 'Left' and 'Znam'"": {""Questions"": [{""question"": ""What is the definition of 'national unity' in this context?"", ""search_results"": [""National unity refers to the process of establishing a common identity and cohesion among individuals within a nation, often through the shared use of a\u00a0..."", ""Dec 1, 1995 ... 'joint committee' means a joint committee of the Houses of Parliament appointed in accordance with the Standing Orders of Parliament for the\u00a0..."", ""... nation. In the context of Shakespeare's history plays, national unity is portrayed as essential for political stability and the success of leadership.""], ""stance"": ""Partially Supports""}, {""question"": ""Are there any specific attacks or issues related to parties 'Left' and 'Znam' that need to cease for national unity?"", ""search_results"": [""Apr 24, 2024 ... The International Institute for Middle East and Balkan Studies (IFIMES) based in Ljubljana, Slovenia, regularly conducts analyses of events\u00a0..."", ""Apr 24, 2024 ... The legal framework establishes the basis for holding democratic elections, however, key aspects of the presidential election, including some\u00a0..."", ""Jan 20, 2025 ... As argued elsewhere and in line with our findings, conspiracy theory and its respective interpretations associated with topics involving the \u201c\u00a0...""], ""stance"": ""No Evidence""}, {""question"": ""Do the presidential candidates offer concrete policies or only promises and slogans?"", ""search_results"": [""Sep 26, 2024 ... Vice President Kamala Harris has a plan for the economy: a glossy, 82-page booklet detailing proposals on housing, taxes and health care."", ""Donations to the Republican party and candidates increased dramatically. The ... Do they mean peace, or do they mean we just want to be left in peace?"", ""Jun 29, 2023 ... It can also depend on their race. The question pre- sented is whether the admissions systems used by Harvard College and UNC are lawful under\u00a0...""], ""stance"": ""Refute""}]}, ""We must find a common language, regardless of personal or partisan interests"": {""Questions"": [{""question"": ""What is the context of finding a common language mentioned in the claim?"", ""search_results"": [""4th 1231, 1236-37, 2023 USPQ2d 1030 (Fed. Cir. 2023), the court found that construing \u201cconnection rejection message\u201d should be given its plain and ordinary\u00a0..."", ""All Massachusetts frameworks are subject to continuous review and improvement for the benefit of the students of the Commonwealth. We hope you will find this\u00a0..."", ""For example, if the language of a claim, given its broadest reasonable interpretation, is such that a person of ordinary skill in the relevant art would read it\u00a0...""], ""stance"": ""Partially Supports""}, {""question"": ""In what way do presidential candidates offer a range of promises and slogans, as described in the claim?"", ""search_results"": [""The speech was aired on October 27, 1964 and it was electrifying. Donations to the Republican party and candidates increased dramatically."", ""Jun 29, 2023 ... Harvard College and the University of North Carolina (UNC) are two of the oldest institutions of higher learning in the United States. Every."", ""Oct 25, 2024 ... \""The proudest thing I can claim is that I am from Abilene.\"" Homecoming Speech, Abilene, Kansas, 6/22/45 Audio clip. \""Don't defend yourself. Don'\u00a0...""], ""stance"": ""Irrelevant""}, {""question"": ""What are the specific characteristics or attributes that the future President of North Macedonia should possess, according to the dilemmas presented in the claim?"", ""search_results"": [""Dec 2, 2021 ... Five years after President Rodrigo Duterte's pivot to China, tensions between Manila and Beijing are rising again in the South China Sea,\u00a0..."", ""Global. Trends reflects the National Intelligence Council's perspective on these future trends; it does not represent the official, coordinated view of the US\u00a0..."", ""Morphological identifiers mainly consist of fingerprints, the hand's shape, the finger vein pattern, the eye (iris and retina), and the face's shape. For\u00a0...""], ""stance"": ""Irrelevant""}]}}","{""National unity is more important than ever"": {""What is the current state of national unity in North Macedonia?"": ""Partially Supports"", ""To what extent do the presidential candidates promise to prioritize national unity during their campaign?"": ""Partially Supports"", ""How will the winner of the upcoming presidential election be expected to address the issue of national unity?"": ""Irrelevant""}, ""It's necessary to ensure national unity by ceasing attacks on parties 'Left' and 'Znam'"": {""What is the definition of 'national unity' in this context?"": ""Partially Supports"", ""Are there any specific attacks or issues related to parties 'Left' and 'Znam' that need to cease for national unity?"": ""No Evidence"", ""Do the presidential candidates offer concrete policies or only promises and slogans?"": ""Refute""}, ""We must find a common language, regardless of personal or partisan interests"": {""What is the context of finding a common language mentioned in the claim?"": ""Partially Supports"", ""In what way do presidential candidates offer a range of promises and slogans, as described in the claim?"": ""Irrelevant"", ""What are the specific characteristics or attributes that the future President of North Macedonia should possess, according to the dilemmas presented in the claim?"": ""Irrelevant""}}",Not Spreading Misinformation,"{""Completely Supports"": 0, ""Partially Supports"": 4, ""Refute"": 1, ""Irrelevant"": 3, ""No Evidence"": 1, ""Unknown"": 0}"
752637006982957,"{""We are starting from Vele\u0161 because every piece of the pavement is History."": {""Questions"": [{""question"": ""What does 'every piece of the pavement is History' mean in this context?"", ""search_results"": [""... are all examples of sustainable pavement assessment methods. ... It was further noted that the Pavement-ME climate models are based on historical data and future."", ""pavements where the less expensive binder from RAP can replace a portion ... Milling is an important part of pavement rehabilitation used to remove any distressed\u00a0..."", ""... definition for asphalt pavement (AC over PCC) but the asphalt binder could be ... Second, it became clear that longitudinal joints should be used every 3.0 to\u00a0...""], ""stance"": ""Partially Supports""}, {""question"": ""In what year were the presidential candidates Biljana Vankovsk\u00ebn, Maksim Dimitrievski, and Stef\u00e7e Jakimovski born?"", ""search_results"": [], ""stance"": ""No Evidence""}, {""question"": ""Who are the seven aspirants running for President, mentioned in the article?"", ""search_results"": [""... President, and such Officer shall act accordingly, until the Disability be removed, or a President shall be elected. The President shall, at stated Times\u00a0..."", ""Aug 9, 2024 ... From songs to toys to cigarette packs, presidential candidates throughout U.S. history have found creative ways to reach the public."", ""May 16, 2019 ... Seven Democratic presidential candidates gathered on national ... As Paul Tsongas, the former senator and presidential candidate, once said\u00a0...""], ""stance"": ""Irrelevant""}]}, ""We will not stop until we shake things up like shaking an apple!"": {""Questions"": [{""question"": ""How is the phrase 'shaking things up like shaking an apple' related to the Macedonian presidential election?"", ""search_results"": [""... in the 2027 presidential election, Fareed speaks with The Economist's Sophie Pedder about this shake-up in French politics. Finally, The Atlantic's Yoni\u00a0..."", ""Mar 22, 2024 ... It's also looking like he'd take voters away from former President ... shake things up given how close the election seems now. Can this\u00a0..."", ""... in the 2027 presidential election, Fareed speaks with The Economist's Sophie Pedder about this shake-up in French politics. Finally, The Atlantic's Yoni\u00a0...""], ""stance"": ""Partially Supports""}, {""question"": ""What are the key promises and slogans being offered by the candidates in the Macedonian presidential election?"", ""search_results"": [""Apr 24, 2024 ... The vote for the largely ceremonial presidency is widely seen as a litmus test for a parliamentary election next month in which VMRO-DPMNE is\u00a0..."", ""In 2001 Macedonia could look back to regular general presidential, parliamentary and local government elections, where a number of parties or candidates ran\u00a0..."", ""May 7, 2024 ... Pre-election polls and the outcome of the first round of the presidential election on April 24 indicate that a convincing victory is within\u00a0...""], ""stance"": ""Irrelevant""}, {""question"": ""What specific qualities or attributes do the presidential candidates in North Macedonia believe the next President should have?"", ""search_results"": [""Oct 10, 2024 ... ... candidate has \u201cthe personality and leadership qualities a president should have. ... coming soon after the presidential debate, could have\u00a0..."", ""... specific candidate who they believe should be President. Before the ... do not have the same obligation to vote for a certain candidate. Democrats call\u00a0..."", ""The next parliamentary election (unless there is an early election) is scheduled to take place in 2024, which is also when the next presidential election is\u00a0...""], ""stance"": ""Refute""}]}, ""The people's spirit should never fall, as Racin would say: 'Let the dust settle'!"": {""Questions"": [{""question"": ""What is the quote 'Let the dust settle' attributed to?"", ""search_results"": [""May 5, 2022 ... 1.7K votes, 650 comments. I'm reading East of Eden by John Steinbeck right now and I wanted to share a passage that struck me, as many have\u00a0..."", ""Aug 17, 2020 ... Mozammel Haque Nikson at the end of each video, Nijo Jonson tells you where to reach him. 5 yrs."", ""Jun 15, 2023 ... We called a foundation repair company because the cosmetic fix (done by the previous owner) started crumbling, alerting us to the problem.""], ""stance"": ""Refute""}, {""question"": ""What are the presidential candidates offering in terms of promises and slogans?"", ""search_results"": [""Many leaders of the Democratic Party saw in Roosevelt an attractive mixture of experience (as governor of New York and as a former vice presidential candidate)\u00a0..."", ""Mar 2, 2022 ... John F. Kennedy was elected president in one of the closest elections in United States history. Kennedy's popular vote margin over Nixon was\u00a0..."", ""In those days, the candidate receiving the second-highest vote became the vice president. In a scheme to deny Adams the presidency, Alexander Hamilton\u00a0...""], ""stance"": ""No Evidence""}, {""question"": ""What are the concrete proposals being offered by the seven presidential aspirants mentioned?"", ""search_results"": [""(7) Reason why the applicable covered article or the product or service is being provided or used; ... being listed with an exclusion in SAM. (3) The\u00a0..."", ""Aug 19, 2024 ... He is the candidate who wants to defund the police: As president, he repeatedly proposed cutting funding to state and local law enforcement\u00a0..."", ""Oct 29, 2024 ... Amna Nawaz: So, William, you also mentioned school choice. We know that's something former President Trump has been a big proponent of, and that\u00a0...""], ""stance"": ""Irrelevant""}]}}","{""We are starting from Vele\u0161 because every piece of the pavement is History."": {""What does 'every piece of the pavement is History' mean in this context?"": ""Partially Supports"", ""In what year were the presidential candidates Biljana Vankovsk\u00ebn, Maksim Dimitrievski, and Stef\u00e7e Jakimovski born?"": ""No Evidence"", ""Who are the seven aspirants running for President, mentioned in the article?"": ""Irrelevant""}, ""We will not stop until we shake things up like shaking an apple!"": {""How is the phrase 'shaking things up like shaking an apple' related to the Macedonian presidential election?"": ""Partially Supports"", ""What are the key promises and slogans being offered by the candidates in the Macedonian presidential election?"": ""Irrelevant"", ""What specific qualities or attributes do the presidential candidates in North Macedonia believe the next President should have?"": ""Refute""}, ""The people's spirit should never fall, as Racin would say: 'Let the dust settle'!"": {""What is the quote 'Let the dust settle' attributed to?"": ""Refute"", ""What are the presidential candidates offering in terms of promises and slogans?"": ""No Evidence"", ""What are the concrete proposals being offered by the seven presidential aspirants mentioned?"": ""Irrelevant""}}",Spreading Misinformation,"{""Completely Supports"": 0, ""Partially Supports"": 2, ""Refute"": 2, ""Irrelevant"": 3, ""No Evidence"": 2, ""Unknown"": 0}"
