ad_archive_id,claims_to_questions,stance_results,verdict,stance_counts
432647419356542,"{""There is no change in March regarding which political party uses harmful narratives in communication the most. V\u041c\u0420\u041e-D\u041f\u041c\u041d\u0415 and \u0421\u0414\u0421\u041c are the two largest parties that use such narratives."": {""Questions"": [{""question"": ""Is there a change in March regarding which political party uses harmful narratives in communication the most?"", ""search_results"": [""Sep 5, 2023 ... ... Democratic side and more conservatives on the Republican side ... About Party Composition and Their Consequences,\u201d Journal of Politics 80, no."", ""and will change their product and strategy in line with what serves their ... More specifically: on the positive side, there is the undeniable consumer benefit."", ""For them, black power was a global revolution. Organizing a Revolutionary Party Huey Newton and Bobby Seale, young political activists in Oakland, California,\u00a0...""], ""stance"": ""Refute""}, {""question"": ""Are V\u041c\u0420\u041e-D\u041f\u041c\u041d\u0415 and \u0421\u0414\u0421\u041c the only two parties that use such narratives?"", ""search_results"": [], ""stance"": ""No Evidence""}, {""question"": ""Do any of the presidential candidates offer specific promises or slogans to appeal to voters?"", ""search_results"": [""Mar 2, 2022 ... John F. Kennedy was elected president in one of the closest elections in United States history. Kennedy's popular vote margin over Nixon was\u00a0..."", ""Many leaders of the Democratic Party saw in Roosevelt an attractive mixture of experience (as governor of New York and as a former vice presidential candidate)\u00a0..."", ""An election contest with more candidates that there are vacancies for that election. ... any individual can report a complaint or allegation of a voting\u00a0...""], ""stance"": ""Refute""}]}, ""The Left also starts to be included, while at DU\u0418 there is an increase in similar announcements compared to previous months."": {""Questions"": [{""question"": ""What does the phrase 'The Left also starts to be included' refer to?"", ""search_results"": [""Apr 16, 2025 ... ... are responsible for language. For most people, areas in the left side of the brain are affected. Aphasia impairs the expression and\u00a0..."", ""Mar 11, 2025 ... Heart failure means that your heart can't pump enough oxygen-rich blood to meet your body's needs. Heart failure doesn't mean that your heart\u00a0..."", ""Feb 14, 2024 ... These include high microsatellite instability (MSI-high) \u2013 also referred to as DNA mismatch repair deficiency (dMMR) \u2013 and Lynch syndrome. Left-\u00a0...""], ""stance"": ""Partially Supports""}, {""question"": ""What is the specific increase being described in 'similar announcements compared to previous months'?"", ""search_results"": [""These cookies last for 6 months and for 13 months, respectively. ... Cookies and similar technologies may also be used to improve the performance of Google\u00a0..."", ""However, the new application must be substantially different in content from any prior funded K07 grant. If an application seeks to continue or expand a prior\u00a0..."", ""A dependent losing eligibility for group health coverage may be able to enroll in a different parent's group health plan. To have a special enrollment.""], ""stance"": ""No Evidence""}, {""question"": ""What are the main differences between the promises and slogans offered by the different presidential candidates?"", ""search_results"": [""Thomas Jefferson operated as the informal leader of what would become the nation's first opposition political party, the Democratic-Republicans."", ""Mar 2, 2022 ... John F. Kennedy was elected president in one of the closest elections in United States history. Kennedy's popular vote margin over Nixon was\u00a0..."", ""The Campaign and Election of 1912. Although Woodrow Wilson was convinced that God had destined him to be president, it took all his political skill and a good\u00a0...""], ""stance"": ""No Evidence""}]}, ""This shows the latest, fifth report from the Institute for Communication Studies within the research framework 'Measuring political harmful narratives' (SH\u0422\u0415\u0422-\u041d\u0410)."": {""Questions"": [{""question"": [""Does the Institute for Communication Studies publish a report on 'Measuring political harmful narratives'?""], ""search_results"": [""This report was commissioned by the Australian Competition and Consumer. Commission (ACCC) as an input to the Digital Platforms Inquiry. The Centre was asked by\u00a0..."", ""Oct 23, 2023 ... ... can harm voters, candidates, news outlets: What the research says ... Post and 12 other newspapers that report on Virginia politics. When\u00a0..."", ""Sep 5, 2023 ... What can be done about polarization in the United States? Reviewing a decade of research reveals unexpected findings.""], ""stance"": ""Partially Supports""}, {""question"": [""Are there seven presidential candidates in the election?"", ""This claim mentions specific ages of candidates Biljana Vankovsk\u00ebn, Maksim Dimitrievski and Stef\u00e7e Jakimovski.""], ""search_results"": [""Seven candidates did compete in the election for the presidency of the ... Candidature documents for the IOC presidential candidates now available. 19\u00a0..."", ""... their parish from 14 to seven days prior to any scheduled election. When one ... For presidential elections, the early voting period is from 18 to\u00a0..."", ""Sep 16, 2024 ... Seven candidates will compete in the election for the presidency of ... The candidates will present their programmes, in camera, to the\u00a0...""], ""stance"": ""Partially Supports""}, {""question"": [""Is Enis Shaqiri an author who writes about this topic?""], ""search_results"": ["", RITK, Kosovo. Premtim Shaqiri, Kosovo Defense Academy, Kosovo. Robert Muharremi, RITK, Kosovo. Venera Demukaj, RITK, Kosovo. Book Review Editor ... issue: All\u00a0..."", ""Please note, combine shipping is not available once order has been checked out. For buyers from other countires,. Shipping, packaging and handling fees are\u00a0..."", ""MSc in Social Development, Chevening Scholar \u00b7 UCL \u00b7 Skopje \u00b7 17 connections on LinkedIn. View Azra Misini's profile on LinkedIn, a professional community\u00a0...""], ""stance"": ""Refute""}]}}","{""There is no change in March regarding which political party uses harmful narratives in communication the most. V\u041c\u0420\u041e-D\u041f\u041c\u041d\u0415 and \u0421\u0414\u0421\u041c are the two largest parties that use such narratives."": {""Is there a change in March regarding which political party uses harmful narratives in communication the most?"": ""Refute"", ""Are V\u041c\u0420\u041e-D\u041f\u041c\u041d\u0415 and \u0421\u0414\u0421\u041c the only two parties that use such narratives?"": ""No Evidence"", ""Do any of the presidential candidates offer specific promises or slogans to appeal to voters?"": ""Refute""}, ""The Left also starts to be included, while at DU\u0418 there is an increase in similar announcements compared to previous months."": {""What does the phrase 'The Left also starts to be included' refer to?"": ""Partially Supports"", ""What is the specific increase being described in 'similar announcements compared to previous months'?"": ""No Evidence"", ""What are the main differences between the promises and slogans offered by the different presidential candidates?"": ""No Evidence""}, ""This shows the latest, fifth report from the Institute for Communication Studies within the research framework 'Measuring political harmful narratives' (SH\u0422\u0415\u0422-\u041d\u0410)."": {""Does the Institute for Communication Studies publish a report on 'Measuring political harmful narratives'?"": ""Partially Supports"", ""Are there seven presidential candidates in the election?"": ""Partially Supports"", ""Is Enis Shaqiri an author who writes about this topic?"": ""Refute""}}",Spreading Misinformation,"{""Completely Supports"": 0, ""Partially Supports"": 3, ""Refute"": 3, ""Irrelevant"": 0, ""No Evidence"": 3, ""Unknown"": 0}"
318839371222287,"{""Online media outlets broadcast approximately two harmful narratives per piece, mainly disseminating information from parties or speeches by politicians."": {""Questions"": [{""question"": ""Is there a specific claim that online media outlets broadcast approximately two harmful narratives per piece?"", ""search_results"": [""Dec 11, 2024 ... ... TV news stories about crime raises their support for punitive policies. Problematic media coverage of crime is often cited as a cause why, in\u00a0..."", ""... the left more uncomfortable about the societal impact of harmful online content. ... part in US media narratives. Across countries, comfort levels are\u00a0..."", ""Oct 19, 2017 ... Experts are evenly split on whether the coming decade will see a reduction in false and misleading narratives online.""], ""stance"": ""Partially Supports""}, {""question"": ""What is the main source of information for online media outlets, according to the claim?"", ""search_results"": [""... main source of online news \u2013 that's down 10 percentage points on 2018. ... news each week \u2013 around 4% across countries according to our data. The majority\u00a0..."", ""According to UGA Libraries, a reliable source will provide a \u201cthorough, well-reasoned theory, argument, etc. based on strong evidence.\u201d Widely credible sources\u00a0..."", ""Oct 19, 2017 ... ... major information platform companies ... information sources it has hurt the reach and influence of the traditional news organizations.""], ""stance"": ""Partially Supports""}, {""question"": ""Are the presidential candidates in North Macedonia's elections offering a wide range of promises and slogans as part of their campaigns?"", ""search_results"": [""Jan 31, 2024 ... Cybersecurity for Elections and Campaigns. There is good reason to think that campaign- and election-related cybersecurity can be significantly\u00a0..."", ""Even during earlier presidential elections there had been less violence than during the parliamentary elections. ... promoted its ideas in huge campaigns\u00a0..."", ""Nov 7, 2018 ... Relying on the extensive scientific literature on populism, this report identifies 46 populist leaders or political parties that have held\u00a0...""], ""stance"": ""Partially Supports""}]}, ""Mostly, harmful narratives are transmitted without any intervention, but there are cases where a journalist even endorses them."": {""Questions"": [{""question"": ""What is the main point of the article?"", ""search_results"": [""The main idea of a paragraph is the author's message about the topic. It is often expressed directly or it can be implied. Knowing how to find main ideas\u00a0..."", ""I have tips for you that will help you improve your skills in not only finding the main points, but also explaining why those points count."", ""... articles of the 1610 Remonstrance. Main Points Three and Four were combined into one, always designated as Main Point Three/Four. Each of the main points\u00a0...""], ""stance"": ""Irrelevant""}, {""question"": ""Do the presidential candidates in North Macedonia's election promise a wide range of things to gain voters?"", ""search_results"": [""Aug 2, 2024 ... ... voting machines (the North Macedonian government has said it has ... If they do spurn elections, it is unclear what other options the\u00a0..."", ""May 8, 2024 ... When is Election Day? The Republic of North Macedonia will hold parliamentary elections on Wednesday, May 8, 2024. Voting will take place from 7\u00a0..."", ""Nevertheless, declines outpaced gains in the region as a whole in 2017. In Honduras, after an early presidential vote count favored the opposition candidate\u00a0...""], ""stance"": ""Partially Supports""}, {""question"": ""Is there any specific information mentioned about the presidential candidates' offerings?"", ""search_results"": [""Presidential elections are subject to many of the same funding rules as House and Senate campaigns. For information on how to support a presidential candidate\u00a0..."", ""In preparation for the 2024 presidential election, Penn Wharton Budget Model (PWBM) has compiled a brief guide to our analyses of the candidates' policy\u00a0..."", ""Find what you need to know about the federal campaign finance process. Explore legal resources, campaign finance data, help for candidates and committees,\u00a0...""], ""stance"": ""Partially Supports""}]}, ""Some online media outlets least respected professional journalistic standards."": {""Questions"": [{""question"": ""What evidence is there that some online media outlets have not respected professional journalistic standards?"", ""search_results"": [""consumers get to see. The workings of these algorithms are not transparent. \u2022. The evidence on filter bubbles and echo chambers, and\u00a0..."", ""... journalists on staff in the late 1990s, today have only a few dozen.[19] ... the local level, digital media operations are not constrained by such barriers."", ""Jan 31, 2024 ... ... did not improve, and they remained distrustful of the media as a whole. ... Some of these gaps are being filled by the EU's Digital\u00a0...""], ""stance"": ""Partially Supports""}, {""question"": ""Are the presidential candidates in North Macedonia offering a wide range of promises and slogans to attract voters?"", ""search_results"": [""Nov 7, 2018 ... Relying on the extensive scientific literature on populism, this report identifies 46 populist leaders or political parties that have held\u00a0..."", ""Jan 31, 2024 ... While media literacy training shows promise, it suffers challenges in speed, scale, and targeting. Reaching large numbers of people, including\u00a0..."", ""Apr 15, 2019 ... ... presidential elections attract far less attention than parliamentary elections. ... In pursuit of a wide spectrum of voters, opposition\u00a0...""], ""stance"": ""Irrelevant""}, {""question"": ""What specific policies or platforms are being offered by the seven presidential candidates in North Macedonia?"", ""search_results"": [""Apr 15, 2024 ... Voting will be organized the day before Election Day for voters who are homebound due to incapacity or illness; confined to prison, other\u00a0..."", ""Oct 30, 2024 ... addition, contradictory rules in sectoral laws have allowed certain employees to be ... Specific attention should be given to preventing the\u00a0..."", ""Apr 24, 2024 ... Seven candidates will compete for the presidential position ... be, provided they meet the relevant criteria. The Greek parliament\u00a0...""], ""stance"": ""No Evidence""}]}}","{""Online media outlets broadcast approximately two harmful narratives per piece, mainly disseminating information from parties or speeches by politicians."": {""Is there a specific claim that online media outlets broadcast approximately two harmful narratives per piece?"": ""Partially Supports"", ""What is the main source of information for online media outlets, according to the claim?"": ""Partially Supports"", ""Are the presidential candidates in North Macedonia's elections offering a wide range of promises and slogans as part of their campaigns?"": ""Partially Supports""}, ""Mostly, harmful narratives are transmitted without any intervention, but there are cases where a journalist even endorses them."": {""What is the main point of the article?"": ""Irrelevant"", ""Do the presidential candidates in North Macedonia's election promise a wide range of things to gain voters?"": ""Partially Supports"", ""Is there any specific information mentioned about the presidential candidates' offerings?"": ""Partially Supports""}, ""Some online media outlets least respected professional journalistic standards."": {""What evidence is there that some online media outlets have not respected professional journalistic standards?"": ""Partially Supports"", ""Are the presidential candidates in North Macedonia offering a wide range of promises and slogans to attract voters?"": ""Irrelevant"", ""What specific policies or platforms are being offered by the seven presidential candidates in North Macedonia?"": ""No Evidence""}}",Not Spreading Misinformation,"{""Completely Supports"": 0, ""Partially Supports"": 6, ""Refute"": 0, ""Irrelevant"": 2, ""No Evidence"": 1, ""Unknown"": 0}"
262053870229963,"{""We won't tolerate unfair lies"": {""Questions"": [{""question"": ""What is the specific attribute that the next President of North Macedonia should possess?"", ""search_results"": [""Jan 12, 2023 ... In the tripartite presidency of BiH, Republika Srpska's president ... Kosovo, North Macedonia and Montenegro have been mostly in line with Western\u00a0..."", ""Feb 26, 2021 ... The 22-member committee has identified eight attributes they believe a successful candidate will have. \u201cIf we can find a candidate who checks\u00a0..."", ""Rapidly reducing methane emissions from energy, agriculture, and waste can achieve near-term gains in our efforts in this decade for decisive action and is\u00a0...""], ""stance"": ""Irrelevant""}, {""question"": ""How do candidates' promises and slogans aim to attract the electorate?"", ""search_results"": [""Adams won 84 electoral votes followed by 41 for Crawford and 37 for Clay. Jackson was the only candidate to attract significant support beyond his regional base\u00a0..."", ""See through the images \u2014 Slogans, name recognition and personality are often all that come through in campaign materials: 30- to 90- second prepackaged media\u00a0..."", ""The Campaign and Election of 1908: After his 1904 electoral victory, Theodore Roosevelt promised publicly not to seek the presidency again in 1908. While he\u00a0...""], ""stance"": ""Irrelevant""}, {""question"": ""What are the concrete offers made by these seven presidential aspirants, including Biljana Vankovsk\u00ebn, Maksim Dimitrievski, and Stef\u00e7e Jakimovski?"", ""search_results"": [], ""stance"": ""No Evidence""}]}, ""For the freedom of the world's people with songs and joy"": {""Questions"": [{""question"": ""What is the main topic discussed in the article?"", ""search_results"": [""A MeSH Major Topic is one of the main topics discussed in an article. In the list of MeSH Headings assigned to a citation that appear in the PubMed record,\u00a0..."", ""Textbook chapters, articles, paragraphs, sentences, or passages all have topics and main ideas. ... presented and discussed, these longer writings contain\u00a0..."", ""Feb 4, 2025 ... In this article ... This is why feedback (when to solicit it and when to give it) is such an important mentoring discussion topic for mentors and\u00a0...""], ""stance"": ""Irrelevant""}, {""question"": ""What are the candidates promising in their election campaigns?"", ""search_results"": [""Oct 21, 2024 ... ... a 2022 special election as the Libertarian nominee for a South ... Promises Donald Trump has made so far in his campaign for a second term."", ""... encouraging or urging potential voters to vote. This activity includes ... their political campaigns in both the primary and general elections. Prior\u00a0..."", ""Aug 7, 2024 ... We take a focused look at what the Republican presidential nominee is promising right now on the campaign ... a U.S. presidential candidate, a\u00a0...""], ""stance"": ""Refute""}, {""question"": ""Who are the seven presidential aspirants mentioned in the article?"", ""search_results"": [""... cited as a year of political realignment, where Bill ... Seven states and Washington, DC have consistently voted for the Democratic presidential candidate\u00a0..."", ""Oct 31, 2024 ... ... given a role by President Joe Biden to try and ease the border crisis. ... The Great Lakes state has picked the winning presidential candidate in\u00a0..."", ""... students understand the requirements of Indiana's special education rules, found in Article 7. The 2019 Spanish version of Orientaci\u00f3n para el curso: Domine\u00a0...""], ""stance"": ""Irrelevant""}]}, ""Undeterred in the Assembly"": {""Questions"": [{""question"": ""What is the minimum attribute a future President of North Macedonia should possess?"", ""search_results"": [""Rapidly reducing methane emissions from energy, agriculture, and waste can achieve near-term gains in our efforts in this decade for decisive action and is\u00a0..."", ""Jan 20, 2025 ... Therefore, it can be critical for visionary leaders to balance their style and surround themselves with fellow C-levels, directors, managers or\u00a0..."", ""Good teachers also possess a deep understanding of their subject matter and can take that knowledge and make it culturally relevant for students as they develop\u00a0...""], ""stance"": ""No Evidence""}, {""question"": ""What are the main promises and slogans being offered by presidential candidates in the election?"", ""search_results"": [""In those days, the candidate receiving the second-highest vote became the vice president. In a scheme to deny Adams the presidency, Alexander Hamilton\u00a0..."", ""Aug 7, 2024 ... We take a focused look at what the Republican presidential nominee is promising right now on the campaign trail."", ""... Campaign finance \u2022 Logos and slogans \u2022 Key staffers \u2022 Vice presidential candidates \u2022 Policy positions \u2022 Ballotpedia's presidential election coverage index\u00a0...""], ""stance"": ""Refute""}, {""question"": ""When did the presidential election campaign officially start in North Macedonia?"", ""search_results"": [""Feb 29, 2024 ... The official election campaign period begins 20 days before and lasts until 24 hours before election day. The holding of concurrent presidential\u00a0..."", ""Apr 15, 2024 ... On Wednesday, April 24, North Macedonia will hold presidential elections. Elections take place among political tensions within the country,\u00a0..."", ""Sep 23, 2024 ... ... presidential election was competitive, and voters had the ... Key aspects of the presidential election, such as campaign rules\u00a0...""], ""stance"": ""Completely Supports""}]}}","{""We won't tolerate unfair lies"": {""What is the specific attribute that the next President of North Macedonia should possess?"": ""Irrelevant"", ""How do candidates' promises and slogans aim to attract the electorate?"": ""Irrelevant"", ""What are the concrete offers made by these seven presidential aspirants, including Biljana Vankovsk\u00ebn, Maksim Dimitrievski, and Stef\u00e7e Jakimovski?"": ""No Evidence""}, ""For the freedom of the world's people with songs and joy"": {""What is the main topic discussed in the article?"": ""Irrelevant"", ""What are the candidates promising in their election campaigns?"": ""Refute"", ""Who are the seven presidential aspirants mentioned in the article?"": ""Irrelevant""}, ""Undeterred in the Assembly"": {""What is the minimum attribute a future President of North Macedonia should possess?"": ""No Evidence"", ""What are the main promises and slogans being offered by presidential candidates in the election?"": ""Refute"", ""When did the presidential election campaign officially start in North Macedonia?"": ""Completely Supports""}}",Spreading Misinformation,"{""Completely Supports"": 1, ""Partially Supports"": 0, ""Refute"": 2, ""Irrelevant"": 4, ""No Evidence"": 2, ""Unknown"": 0}"
