ad_archive_id,claims_to_questions,stance_results,verdict,stance_counts
929379795548737,"{""DEMOKRATI is against 78% increase in official salaries and supports linear pension increases"": {""Questions"": [{""question"": [""The claim states that DEMOKRATI is against a 78% increase in official salaries. Is the organization's stance on this topic supported by credible sources?""], ""search_results"": [""Jul 29, 2018 ... favorably in the role of supporting government initiatives to resolve the stated crises, they ... opposed to over-relying on official sources."", ""in independent journalism is a true key issue from a democratic point of view. There is, for example, great concern about the consequences of increasingly\u00a0..."", ""The Democracy Report is a signature publication of the. V-Dem Institute and the views and opinions expressed herein do not reflect an official position of the\u00a0...""], ""stance"": ""No Evidence""}, {""question"": [""Is there evidence to support the claim that DEMOKRATI supports linear pension increases?"", ""The presidential candidates mentioned in the article are promoting various promises and slogans. Can their claims be verified through credible sources?""], ""search_results"": [""Dec 3, 2024 ... EcoHealth Alliance Did Not Create COVID-19. Claims that EHA invented SARS-CoV-2 are unsupported by available evidence. EHA is an\u00a0..."", ""power and maintain a strong interest in the development of a democratic. South Africa. The second group (the migrants of the 1990s) are the least likely to\u00a0..."", ""We observe a steeper seniority-wage profile in Sweden. Abstract. We construct multi-country employer-employee data to examine the consequences of last-in,\u00a0...""], ""stance"": ""Irrelevant""}, {""question"": ""What specific policies or initiatives do the presidential candidates Biljana Vankovska, Maksim Dimitrievski, and Stef\u00e7e Jakimovski propose to achieve during their presidency?"", ""search_results"": [], ""stance"": ""No Evidence""}]}, ""DEMOKRATI supports students' demands for better living standards, including timely stipend payments, decent accommodation, and access to internet"": {""Questions"": [{""question"": ""Is DEMOKRATI a student support organization that advocates for better living standards?"", ""search_results"": [""The 2020 Edition presents a new supporting organization for the WIDA ELD Standard ... improve the education of multilingual children, youth, and families."", ""Dec 27, 2024 ... Student aid and education planning \u00b7 Housing benefits \u00b7 Disability benefits ... a better quality of life; a more equitable, gender equal and\u00a0..."", ""... support democracy around the world than any other global organization. The UN promotes good governance, monitors elections, supports civil society to\u00a0...""], ""stance"": ""Refute""}, {""question"": ""What is the main issue dominating the Macedonian presidential election campaign?"", ""search_results"": [""Apr 27, 2014 ... The main issues and priorities of presidential and parliamentary candidates reflected in coalition and party programmes included economic\u00a0..."", ""May 2, 2024 ... Her winning the ceremonial presidency would have little significance ... main topic in the parliamentary elections campaign. VMRO-DPMNE has\u00a0..."", ""The Two-Party System and the Two Major Parties. The electoral system in the U.S. is called a two-party system. That means that two parties dominate the\u00a0...""], ""stance"": ""Refute""}, {""question"": ""Are there specific promises or slogans being offered by presidential candidates in the election?"", ""search_results"": [""In those days, the candidate receiving the second-highest vote became the vice president. In a scheme to deny Adams the presidency, Alexander Hamilton\u00a0..."", ""Mar 2, 2022 ... John F. Kennedy was elected president in one of the closest elections in United States history. Kennedy's popular vote margin over Nixon was\u00a0..."", ""... president of a utility company, as their candidate. It was an unconventional choice. Willkie had voted for FDR in 1932 and had been a Democrat until 1938.""], ""stance"": ""Refute""}]}, ""DEMOKRATI advocates for the development of agriculture and production of all agricultural cultures in Macedonia before importing from abroad"": {""Questions"": [{""question"": ""What is the main focus of DEMOKRATI's agenda in Macedonia?"", ""search_results"": [""Our objective is to promote and advance sustainable democracy and to improve and consolidate electoral processes world-wide."", ""Oct 2, 2024 ... Jens Stoltenberg became NATO Secretary General in October 2014. As a former Prime Minister of Norway and UN Special Envoy, Mr Stoltenberg\u00a0..."", ""Whatever the primary point of conflict might have been, the main objective of the agreement was to improve the status of Macedonia's Albanian citizens. Many\u00a0...""], ""stance"": ""Refute""}, {""question"": ""In what ways do the presidential candidates promise to address agriculture and production in Macedonia?"", ""search_results"": [""Global. Trends reflects the National Intelligence Council's perspective on these future trends; it does not represent the official, coordinated view of the US\u00a0..."", ""Presidential and parliamentary elections were held jointly in July 2024 ... agriculture, services, and industry. Development Challenges Despite\u00a0..."", ""Jul 13, 1992 ... A sufficient and sustainable agricultural economy can be achieved through fiscally responsible programs. ... While government should promise every\u00a0...""], ""stance"": ""Refute""}, {""question"": ""Do the presidential candidates offer any specific plans or policies related to agricultural development in Macedonia?"", ""search_results"": [""Oct 30, 2024 ... parliamentary elections did not bring any improvements in this regard as a number of middle ... encouraged to establish a relevant policy\u00a0..."", ""Political Context Rwanda has maintained its political stability since the 1994 genocide against the Tutsi. \u00b7 Economic Overview Rwanda aspires to become a Middle-\u00a0..."", ""North Macedonia \u2013 along with other Western Balkans partners \u2013 was identified as a potential candidate for EU membership during the Thessaloniki European\u00a0...""], ""stance"": ""Irrelevant""}]}}","{""DEMOKRATI is against 78% increase in official salaries and supports linear pension increases"": {""The claim states that DEMOKRATI is against a 78% increase in official salaries. Is the organization's stance on this topic supported by credible sources?"": ""No Evidence"", ""Is there evidence to support the claim that DEMOKRATI supports linear pension increases?"": ""Irrelevant"", ""What specific policies or initiatives do the presidential candidates Biljana Vankovska, Maksim Dimitrievski, and Stef\u00e7e Jakimovski propose to achieve during their presidency?"": ""No Evidence""}, ""DEMOKRATI supports students' demands for better living standards, including timely stipend payments, decent accommodation, and access to internet"": {""Is DEMOKRATI a student support organization that advocates for better living standards?"": ""Refute"", ""What is the main issue dominating the Macedonian presidential election campaign?"": ""Refute"", ""Are there specific promises or slogans being offered by presidential candidates in the election?"": ""Refute""}, ""DEMOKRATI advocates for the development of agriculture and production of all agricultural cultures in Macedonia before importing from abroad"": {""What is the main focus of DEMOKRATI's agenda in Macedonia?"": ""Refute"", ""In what ways do the presidential candidates promise to address agriculture and production in Macedonia?"": ""Refute"", ""Do the presidential candidates offer any specific plans or policies related to agricultural development in Macedonia?"": ""Irrelevant""}}",Spreading Misinformation,"{""Completely Supports"": 0, ""Partially Supports"": 0, ""Refute"": 5, ""Irrelevant"": 2, ""No Evidence"": 2, ""Unknown"": 0}"
1602001287215398,"{""We teach students to read laws, and ask who makes the laws? Lawmakers are... Let me count five MPs if it will go through. And I'm calling out why such people make our laws, better we should do it ourselves, let us get inside"": {""Questions"": [{""question"": ""Is the claim that lawmakers make laws accurate?"", ""search_results"": [""Lawmakers enacted SB 343 (Allen, Chapter 507, Statues of 2021), which ... Although existing laws make it illegal to use deceptive labels on products\u00a0..."", ""Codified Laws; >; 12; >; 27; >; 27 \u00b7 Previous Next. Go To:(1-1-1) or Google Search ... make the statement or report accurate. A person responsible for filing a\u00a0..."", ""The Code Reviser's Office helps make Washington's laws clear, accurate, and ... They support lawmakers, keep records updated, and make sure everyone\u00a0...""], ""stance"": ""Partially Supports""}, {""question"": ""What is the role of lawmakers in making laws, as described by the speaker?"", ""search_results"": [""These responsibilities are carried out through the legislative process \u2014 laws passed by elected representatives of the people, legislators. Since statehood in\u00a0..."", ""... legislative function is essentially that of proposing, considering and enacting laws. ... Speaker; if the latter disagree, the Legislative Council resolves\u00a0..."", ""assume the duties of the President and the Speaker when they are absent from the Legislature. The Rules provide that if the presiding officer does not make\u00a0...""], ""stance"": ""Completely Supports""}, {""question"": ""Does the statement 'better we should do it ourselves' refer to a specific proposal or action being taken?"", ""search_results"": [""May 24, 2015 ... Otherwise, we would not be doing the creatures themselves any good ... we can and must have with what is other than ourselves. Together\u00a0..."", ""The general rule is to avoid strictly any conflict of interest or even the appearance of a conflict of interest in Government-contractor relationships."", ""It communicates a sense that your research will follow logically from what you have done and that it will be different, important, and innovative. It gives a\u00a0...""], ""stance"": ""Irrelevant""}]}}","{""We teach students to read laws, and ask who makes the laws? Lawmakers are... Let me count five MPs if it will go through. And I'm calling out why such people make our laws, better we should do it ourselves, let us get inside"": {""Is the claim that lawmakers make laws accurate?"": ""Partially Supports"", ""What is the role of lawmakers in making laws, as described by the speaker?"": ""Completely Supports"", ""Does the statement 'better we should do it ourselves' refer to a specific proposal or action being taken?"": ""Irrelevant""}}",Not Spreading Misinformation,"{""Completely Supports"": 1, ""Partially Supports"": 1, ""Refute"": 0, ""Irrelevant"": 1, ""No Evidence"": 0, ""Unknown"": 0}"
422896030250444,"{""JKP Vodovod so doping recognize that the channels intended for atmospheric waters are considered as a type of sewage network, which effectively puts the health of many residents of Ilinaden municipality in danger."": {""Questions"": [{""question"": ""How does JKP Vodovod recognize the channels intended for atmospheric waters as a type of sewage network?"", ""search_results"": [""A recent national representative survey on water, sanitation and hygiene conditions (WASH) in health care facilities (HCFs) (2019, supported by the WHO)3 showed\u00a0..."", ""Blue areas (water and water land) are planned to ... JKP \u201cBeogradski Vodovod i Kanalizacija\u201d (PUC \u201cBelgrade Water Supply and Sewage Systems\u201d) Webpage."", ""Jul 10, 2009 ... municipality has 120 km network of storm water channels and these channels are also the primary recipient of the treated effluent from the\u00a0...""], ""stance"": ""Partially Supports""}, {""question"": ""What is the main health risk posed to residents of Ilinaden municipality according to this claim?"", ""search_results"": [], ""stance"": ""No Evidence""}, {""question"": ""Are there any specific promises or slogans made by the presidential candidates mentioned in this article?"", ""search_results"": [""In those days, the candidate receiving the second-highest vote became the vice president. In a scheme to deny Adams the presidency, Alexander Hamilton\u00a0..."", ""Mar 19, 2020 ... presidential candidates have registered their ... specific issue, there is some discussion of trademark protection for political slogans."", ""... any specific programs or policies. Roosevelt was so ... Willkie of Indiana, a corporate lawyer and president of a utility company, as their candidate.""], ""stance"": ""Refute""}]}, ""The present and past management of DPNE have put residents at risk of various diseases due to the spread of fecal matter on open space."": {""Questions"": [{""question"": ""What is the specific evidence that shows the present and past management of DPNE have put residents at risk of various diseases?"", ""search_results"": [""Sep 30, 2022 ... falls and fall-related injuries are common in older adults, have negative effects on functional independence and quality of life and are\u00a0..."", ""At least 2 million people have an opioid use disorder (OUD) involving prescription opioids, and almost 600,000 have an OUD associated with heroin (HHS, 2016)."", ""Jan 12, 2024 ... Many of these ethnoracial differences in the incidence, course and treatment of mental disorders have been linked with increased exposure to\u00a0...""], ""stance"": ""Refute""}, {""question"": ""How does the spread of fecal matter on open space relate to the current or previous management of DPNE?"", ""search_results"": [""May 17, 2024 ... Rarely, a school might need specialized or enhanced cleaning and disinfection for a particular infectious disease. This can occur when a new\u00a0..."", ""center is located in an area where past or current chemical use could pose a threat ... space or equipment you plan to use at the public school facility does."", ""Feb 27, 2024 ... \""I'm worried about germs spreading in the hospital. Will you please clean your hands once more before you start my treatment?\"" Speak up for\u00a0...""], ""stance"": ""Irrelevant""}, {""question"": ""What are the key differences in the promises and slogans offered by the seven presidential candidates, and how do these differences impact their potential for attracting voters?"", ""search_results"": [""These differences help explain how a key benefit of journalism \u2013 its function in advancing the public interest \u2013 is also a reason for the difficulties in\u00a0..."", ""Angry supporters of then-president Donald Trump, believing false accusations that Dominion had switched votes in favor of Joe Biden, published Coomer's home\u00a0..."", ""Jun 29, 2023 ... It can also depend on their race. The question pre- sented is whether the admissions systems used by Harvard College and UNC are lawful under\u00a0...""], ""stance"": ""No Evidence""}]}, ""DPNE charges citizens for non-existent services, just like SDS, for example, through a regulatory commission for access to a network in electricity bills, while DPNM does so through JKP Vodovod for sewage in an inexistent sewer network."": {""Questions"": [{""question"": ""Does DPNE charge citizens for non-existent services through a regulatory commission, similar to SDS?"", ""search_results"": [""Nov 13, 2024 ... If an existing policyholder or a named beneficiary is blocked by OFAC and the provision of insurance services is not authorized or exempt, then\u00a0..."", ""This publication does not alter or determine compliance responsibilities which are set forth in OSHA standards, and the. Occupational Safety and Health Act."", ""CAUTION: Does not include formal complaint filed with EEOC (Equal Employment Opportunity Commission). ... Schedules of prices charged by an agency for services\u00a0...""], ""stance"": ""Refute""}, {""question"": ""What is the specific network or service that DPNM claims exists but does not actually provide through JKP Vodovod?"", ""search_results"": [""plastic strain does not allow adequate description of dilatancy and ... ground into blocks that are not strictly vertical, but rather have a certain\u00a0..."", ""Mar 2, 2012 ... ... and are still changing the way how software development is done. It is definitively becoming clear (if it is not already) that both developing\u00a0...""], ""stance"": ""Irrelevant""}, {""question"": ""Are there any concrete promises or actions offered by the presidential candidates Biljana Vankovski, Maksim Dimitrievski, and Stef\u00e7e Jakimovski?"", ""search_results"": [], ""stance"": ""No Evidence""}]}}","{""JKP Vodovod so doping recognize that the channels intended for atmospheric waters are considered as a type of sewage network, which effectively puts the health of many residents of Ilinaden municipality in danger."": {""How does JKP Vodovod recognize the channels intended for atmospheric waters as a type of sewage network?"": ""Partially Supports"", ""What is the main health risk posed to residents of Ilinaden municipality according to this claim?"": ""No Evidence"", ""Are there any specific promises or slogans made by the presidential candidates mentioned in this article?"": ""Refute""}, ""The present and past management of DPNE have put residents at risk of various diseases due to the spread of fecal matter on open space."": {""What is the specific evidence that shows the present and past management of DPNE have put residents at risk of various diseases?"": ""Refute"", ""How does the spread of fecal matter on open space relate to the current or previous management of DPNE?"": ""Irrelevant"", ""What are the key differences in the promises and slogans offered by the seven presidential candidates, and how do these differences impact their potential for attracting voters?"": ""No Evidence""}, ""DPNE charges citizens for non-existent services, just like SDS, for example, through a regulatory commission for access to a network in electricity bills, while DPNM does so through JKP Vodovod for sewage in an inexistent sewer network."": {""Does DPNE charge citizens for non-existent services through a regulatory commission, similar to SDS?"": ""Refute"", ""What is the specific network or service that DPNM claims exists but does not actually provide through JKP Vodovod?"": ""Irrelevant"", ""Are there any concrete promises or actions offered by the presidential candidates Biljana Vankovski, Maksim Dimitrievski, and Stef\u00e7e Jakimovski?"": ""No Evidence""}}",Spreading Misinformation,"{""Completely Supports"": 0, ""Partially Supports"": 1, ""Refute"": 3, ""Irrelevant"": 2, ""No Evidence"": 3, ""Unknown"": 0}"
2070252356681949,"{""VLEN is in high demand"": {""Questions"": [{""question"": ""What is VLEN and why it's in high demand?"", ""search_results"": [""May 19, 2023 ... Glen Canyon Dam is the second highest concrete-arch dam in the ... needs of the West's rapidly growing population. With a total\u00a0..."", ""We educate students in a variety of high-demand fields such as radio ... its educational programs and activities (including employment and application\u00a0..."", ""Jan 10, 2025 ... ... Glen after that. We need a proper plan from them - it is really disturbing to see the force of the water and the number of homes flooded.""], ""stance"": ""Partially Supports""}, {""question"": ""Who are the presidential candidates running for office in North Macedonia?"", ""search_results"": [""Apr 15, 2024 ... Elections take place among political tensions within the country, increased disillusionment with democratic reforms, and aspirations of European\u00a0..."", ""SKOPJE, 9 May 2024 \u2013 North ... Public confidence in the election administration was generally high, and training for election officials was comprehensive, although voter education remained limited."", ""Candidates \u00b7 1. Stevo Pendarovski (incumbent), SDSM 28 February 2024 \u00b7 2. Gordana Siljanovska-Davkova \u00b7 VMRO-DPMNE 22 February 2024 \u00b7 3. Stev\u010do Jakimovski \u00b7 GROM\u00a0...""], ""stance"": ""Irrelevant""}, {""question"": ""What are the specific qualifications or attributes that the next President of North Macedonia should possess?"", ""search_results"": [""Illinois veterans who served overseas or were mobilized by the. President of the United States and have a form DD214 can submit their form to IDNR's\u00a0..."", ""Given the Macedonia case, villages should consult their legal ... contract or expenditure, unless exempt, must have attached the clerk's certification that."", ""CRITERIA The Medal of Honor is awarded by the President, in the name of Congress, to a person who, while a member of the Army, distinguishes himself or herself\u00a0...""], ""stance"": ""Irrelevant""}]}, ""The demand for VLEN is increasing rapidly"": {""Questions"": [{""question"": ""What does the phrase 'VLEN' refer to?"", ""search_results"": [""The meaning of GLEN is a secluded narrow valley."", ""Feb 7, 2018 ... From Luke 14, where Jesus Himself said, \u201cIf you want to be my disciple, you must love me more than family, more than career, more than material\u00a0..."", ""Jun 7, 2018 ... The word Glen is from the Gaelic language and means \""in the valley of\"", but makes no other reference to any association with Scotland.""], ""stance"": ""Refute""}, {""question"": ""In what context is the demand for VLEN increasing rapidly?"", ""search_results"": [""Findings, Context and Implications. EXECUTIVE SUMMARY. Page 3 ... rapid industrial growth and growing demand of data centers in PGE's service territory.\u201d."", ""Apr 13, 2015 ... As a result, the importance of service research and the need for new service-related knowledge have never been greater. Accompanying the growing\u00a0..."", ""Aug 29, 2024 ... First was the realisation of the scale of projected increased electricity demand worldwide, but particularly in rapidly-developing countries.""], ""stance"": ""Completely Supports""}, {""question"": ""What are the main promises and slogans being offered by the presidential candidates?"", ""search_results"": [""Aug 7, 2024 ... We take a focused look at what the Republican presidential nominee is promising right now on the campaign trail."", ""... Logos and slogans \u2022 Key staffers \u2022 Vice presidential candidates \u2022 Policy positions \u2022 Ballotpedia's presidential election coverage index. Primaries. Democratic\u00a0..."", ""Jefferson approached the 1800 presidential election well organized for victory and determined to win. One factor that elevated Jefferson's chances of becoming\u00a0...""], ""stance"": ""No Evidence""}]}, ""VLEN has a significant presence"": {""Questions"": [{""question"": ""What is the nature of VLEN's presence?"", ""search_results"": [""Oct 30, 2024 ... general session in presence of the media discussing the need to ... On nature protection, a new law on nature, designed to align with\u00a0..."", ""Sep 28, 2020 ... Presence of other antibodies is highly variable, so these antibodies are not confirmatory for MG. Rather, their presence supports the\u00a0..."", ""Nov 16, 2020 ... He explained how much more difficult it would be to do that with nature recordings compared to matching a database of digital studio recordings.""], ""stance"": ""Partially Supports""}, {""question"": ""What are the key promises and slogans being offered by presidential candidates in North Macedonia?"", ""search_results"": [""May 15, 2024 ... North Macedonia's new president is Gordana Siljanovska-Davkova, who also ran in the previous presidential election in 2019 (she lost in the\u00a0..."", ""May 7, 2024 ... The competing parties are offering only recycled and poorly explained pledges to improve the rule of law and up the fight against corruption."", ""Apr 24, 2024 ... Sign up here. The vote for the largely ceremonial presidency is widely seen as a litmus test for a parliamentary election next month in which\u00a0...""], ""stance"": ""No Evidence""}, {""question"": ""When did the presidential election campaign officially start in North Macedonia?"", ""search_results"": [""Feb 29, 2024 ... The official election campaign period begins 20 days before and lasts until 24 hours before election day. The holding of concurrent presidential\u00a0..."", ""Apr 15, 2024 ... On Wednesday, April 24, North Macedonia will hold presidential elections. Elections take place among political tensions within the country,\u00a0..."", ""Sep 23, 2024 ... ... presidential election was competitive, and voters had the ... Key aspects of the presidential election, such as campaign rules\u00a0...""], ""stance"": ""Partially Supports""}]}}","{""VLEN is in high demand"": {""What is VLEN and why it's in high demand?"": ""Partially Supports"", ""Who are the presidential candidates running for office in North Macedonia?"": ""Irrelevant"", ""What are the specific qualifications or attributes that the next President of North Macedonia should possess?"": ""Irrelevant""}, ""The demand for VLEN is increasing rapidly"": {""What does the phrase 'VLEN' refer to?"": ""Refute"", ""In what context is the demand for VLEN increasing rapidly?"": ""Completely Supports"", ""What are the main promises and slogans being offered by the presidential candidates?"": ""No Evidence""}, ""VLEN has a significant presence"": {""What is the nature of VLEN's presence?"": ""Partially Supports"", ""What are the key promises and slogans being offered by presidential candidates in North Macedonia?"": ""No Evidence"", ""When did the presidential election campaign officially start in North Macedonia?"": ""Partially Supports""}}",Not Spreading Misinformation,"{""Completely Supports"": 1, ""Partially Supports"": 3, ""Refute"": 1, ""Irrelevant"": 2, ""No Evidence"": 2, ""Unknown"": 0}"
